title,score,id,subreddit,url,num_comments,body,created
Excel for 4 banks and multiple accounts?,3,zvlimd,budget,https://www.reddit.com/r/budget/comments/zvlimd/excel_for_4_banks_and_multiple_accounts/,1,"Tl;dr at the end!
So we currently have an excel sheet that my wife and I put together but it's a little hard to look at. Maybe one of you wizards has a similar or better set up. 

We currently use WF CC for most transactions as we get the cash back and have a tab for money spent and marking when the payment reflects on the account details online (sometimes they take a couple of days) as well as a payment made to the balance owed (usually weekly)

Another tab is reserved for the main account that gets my direct deposit. Since its the main account, it has options for categorizing the money spent and whether it was already paid to WF. This data automatically updates to the WF tab. We also keep track of a savings account here with money for car insurance for 6 months, vet bills, termite bond, and HOA stuff; savings we make to pay these off in one go.

There are 2 more tabs for 2 more banks with their respective savings and checking accounts that are rarely used, but when they are, the NFCU account will flag and pull values into these tabs as well. 

I want to see if any of you have built a similar spreadsheet that can allow us to input on one single tab and pull the info into all other tabs as needed with drop down selections or whatever. 

TL;DR: I have 4 banks including my WF CC and various checking and savings accounts that I want to keep track of on excel the easiest way possible i.e. input info once and have dates, amounts, categories and savings reflect on their respective tabs. Thanks in advance!",1672055000.0
"What’s your favorite budgeting hack or strategy? Whether it’s saving, your getting the most out of your dollar.",8,zv08l2,budget,https://www.reddit.com/r/budget/comments/zv08l2/whats_your_favorite_budgeting_hack_or_strategy/,7,,1671982454.0
How to budget?,5,zuw9ap,budget,https://www.reddit.com/r/budget/comments/zuw9ap/how_to_budget/,8,"There's pages online but they're all general. It's all saying 50 30 20 rule, but I actually want a guide on how to actually create and set a budget and stick to it. I get paid weekly n fortnightly so that's hard to start w first of all.. helppppppp 
I've watched so many videos too but they're not specific to my situation.",1671966945.0
What is your New Year's Resolution,8,zuekox,budget,https://www.reddit.com/r/budget/comments/zuekox/what_is_your_new_years_resolution/,21,"First post M 63 never had a new year resolution all my life just wondering what to pick, and test my discipline to stick to it for a year any suggestion appreciated thank you",1671903392.0
Evolution of my Budgeting Spreadsheet,16,zu317x,budget,https://www.reddit.com/r/budget/comments/zu317x/evolution_of_my_budgeting_spreadsheet/,3,"I’ve been updating my budgeting spreadsheet that I use, and I can’t across the very first version that I ever created many years back. 

I thought it was interesting how much it has evolved over time so I thought I’d share here. 

Original:
https://ibb.co/zHGSycK

Current:
https://ibb.co/CQ3zyfg",1671860889.0
Whats the Best Budgeting app?!,15,zszosv,budget,https://www.reddit.com/r/budget/comments/zszosv/whats_the_best_budgeting_app/,37,PS. I got Samsung Phone,1671750339.0
Is this a good idea?,2,zt0etp,budget,https://www.reddit.com/r/budget/comments/zt0etp/is_this_a_good_idea/,1,"I am going to move in a month or so. I just started working. After I move, I plan on having inna sense 2 kinds of savings but not actual savings. 1 is the savings and other isn't.

1. I wanna buy a gaming computer and some set ups for it.

2. I wanna make sure I have money for rent.

What I plan on doing is having enough money for how much I usually spend in my card to pay with. Then rest the money is gonna be in savings. Split in half, one for rent and other for a Gaming PC.",1671751825.0
How to budget when I don't pay for needs?,1,zt11wy,budget,https://www.reddit.com/r/budget/comments/zt11wy/how_to_budget_when_i_dont_pay_for_needs/,6,"I'm 16, a student. I don't have to worry 'bout food etc. (Except checkups and dental stuff 'cause my parents just won't pay for those things. Weird) 

Anyways, what do I do with my money (from school allowance, and other odd jobs)? I don't know what percent to save or spend.",1671753492.0
Fallen off the budgeting bandwagon. Help!,8,zsk86m,budget,https://www.reddit.com/r/budget/comments/zsk86m/fallen_off_the_budgeting_bandwagon_help/,3,"I was doing so well. Managed to save quite a bit for my house purchase. Now I have my home, it’s like I’ve forgotten how to budget. I don’t like any of the apps and used to use a budget planner book which worked well but I just stopped using it and fell hard into old habits. 

I still meet all my financial obligations and pay off credit card balance in full each month and have little left to pay on a personal loan (I’ve made all payments and never defaulted). I make my mortgage payments, bills and other monthly expenses in full too but then any leftover just gets spent and honestly I don’t know where. I can’t remember how I started budgeting in the first place.

How do I start again? How do I keep going and keep the motivation once I hit a goal? I think my issue was that once I reached my goal I back-pedalled and lost the discipline I had. Now I have much bigger financial obligations, I’m at a loss of how to pick things back up again. Xmas hasn’t helped either.",1671709551.0
Which budgeting method do you prefer?,5,zsliar,budget,https://www.reddit.com/r/budget/comments/zsliar/which_budgeting_method_do_you_prefer/,4,"Sorry if you have already seen this. The results of the last poll were inaccurate for my computing project because I didn't make the options clearer.

If you have time let me know why or if I should've added another category.

[View Poll](https://www.reddit.com/poll/zsliar)",1671713877.0
Looking for “pocket” style budgeting service,3,zrs2ye,budget,https://www.reddit.com/r/budget/comments/zrs2ye/looking_for_pocket_style_budgeting_service/,9,"So, I’m currently banking with ONE Finance but I’m looking for a new banking solution due to the lack of transparency & the rate at which they’re removing features. I’m hoping I can just go to a traditional bank & use a budgeting tool on top of my account to help me manage my money. The problem is, I’m not sure which tool to use.

I have ADHD & I impulse spend like crazy but there are two things I love about ONE that really helped me save: I can split my money into different “pockets” so that I only see what I have budgeted to spend when I open the app (instead of all my money at once) + I can assign virtual cards to different pockets. This helps me make sure I only spend a certain amount of money on select services & once the money runs out, they can’t get to my main “pocket” with the rest of my money.

Is there any budgeting service that has these features? Or, is there a way to replicate these features with only a couple of apps? Also, I’ve tried some budgeting apps in the past but couldn’t stick with them because they took a long time to show my transactions so I ended up spending money I didn’t really have. So that’s also a factor for me.

Thank you so much for any help you can provide.",1671638510.0
Can I do this?,4,zrfvls,budget,https://www.reddit.com/r/budget/comments/zrfvls/can_i_do_this/,11,"Recently accepted an offer for a job in a new city, starting at the end of January. It’s a sales position with a base salary as well. The rent in this area is rather high. Although I’m 26 this is my first time going to be living on my own and concerned how I’ll make the budget work with a sort of variable income

Salary is $77,500 paid bi weekly (after taxes I’m figuring it’ll be $2,385 every 2 weeks) 

Rent is $2080/month. Works out to be around 45% of my base salary alone.

Commissions - they are giving me a $9000 draw (guaranteed commissions) spread over the first 6 months and then I’ll have to work for commissions after that. The amount I can make each month with commissions varies greatly so don’t want to rely on that too much

Company also pays for the car, insurance, maintenance, and gas - so no extra expenses for the car

Additional fixed expenses:
-$20/month renters insurance
-apartment complex estimated me $150/month for utilities in summer months and $250/month in summer months
-Wifi: ~$80/month
-gym membership: $30/month
-student loans $180/month

Variable expenses:
-food: never lived completely alone before so not sure what to estimate for this 
-toiletries/cleaning supplies/ etc. : same as food I’ve never lived alone so not sure what to expect 

My main concern is after the commission draw runs out the first 6 months I’m worried my rent is too high for my base salary. Am I being paranoid or can I pull this off?

TLDR: is $2080/rent too high for a $77,500 base salary (before taxes)",1671616096.0
New to Budgeting,6,zr9n13,budget,https://www.reddit.com/r/budget/comments/zr9n13/new_to_budgeting/,4,"Hi I’m having a bit of trouble trying to budget out expenses. I work at Amazon and get paid weekly but I kind of waste a lot of that money on food or clothes or even just going out. I’ve tried hiding my card or locking it but I don’t know how to stop..? I want to get a car and eventually get an apartment but I have a bad habit and need advice on how to fix it.

The crazy part is.? I don’t even buy myself stuff I usually take my family out or give my friends money for games and stupid stuff. Everybody kinda relies on me for money so I stress myself at work to make more but by the time I’ve made that money to help everybody plus myself, I don’t even want it and this repeats my cycle. Please help, winter is fast approaching and Ubers are expensive. (I’m 18F)",1671595163.0
Rate My 2023 Budget,8,zqv2xk,budget,https://www.reddit.com/r/budget/comments/zqv2xk/rate_my_2023_budget/,5,"Okay so I feel like I'm missing something in my budget. My primary financial goal this year is to significantly reduce my debt (its not physically possible for me to get rid of all of it but I'll get damn close. (For TLDR, look at the table at the bottom)

My take-home pay is a little over $27K per year and I get paid twice per month (\~1.1k per paycheck). I'm living with my parents still and they ask for $616 to cover my portion of the bills. My credit card debt as of making this post is about $1,800 and my car loan is $16.5k (I just bought the car this year). The credit cards will be paid of by early March 2023 if I allocate $400/paycheck towards paying them down. 

The minimum payment for the car loan is $377, and after my cards are paid off, I plan on paying at least $200 more (total $577/month). I also plan on putting 75% of any income tax I receive towards paying this down ([This IRS Calculator](https://apps.irs.gov/app/tax-withholding-estimator/about-you/) estimates I'll get $2.7k, so about $2k of this will go towards the car). If I get any bonuses from work, I'll allocate at least 50% of that as well. With that, my car loan should be paid off within 2.5 years (its a 72 month loan, I'm trying to pay it off early to save on interest). In addition to paying down the car loan, I want to increase my savings accounts which I plan on doing after the cards.

&#x200B;

|Monthly Income|$2,300||
|:-|:-|:-|
||**Budget Before Credit Cards are Paid Off:**||
|**Item**|**Cost**|**Percent of Income**|
|Rent|$616|27%|
|Credit card payments|$400|17%|
|Car Payment|$377|16%|
|Variable Charges (gasoline, food, healthcare, etc)|\~$900|40%|
||**Budget After Credit Cards are Paid Off:**||
|Rent|$616|27%|
|Car Payment|$577|25%|
|Variable Charges (gasoline, food, healthcare, etc)|\~$700|30%|
|Savings|\~$400|17%|

Edit: fixed percentages",1671559363.0
What features would you like to see apps / services include?,0,zr1c83,budget,https://www.reddit.com/r/budget/comments/zr1c83/what_features_would_you_like_to_see_apps_services/,1,"Hey everyone,

I'm currently in the process of building a desktop app for budgeting. I thought I'd survey this reddit a little bit before going forward with the designs of everything.

In short, what types of features would you like to see budgeting apps have? What do you think a main dashboard should include and what's a waste of space?

I'd appreciate any and all ideas you've got!",1671574287.0
"If you had $5000 per month, what would your budget look like?",11,zprs9u,budget,https://www.reddit.com/r/budget/comments/zprs9u/if_you_had_5000_per_month_what_would_your_budget/,34,"I feel like my housing, food, cars, etc. are too much, can anyone give me an example budget or national average to compare mine to?",1671456998.0
Factoring pension into retirement,1,zpzi0z,budget,https://www.reddit.com/r/budget/comments/zpzi0z/factoring_pension_into_retirement/,6,I currently work in public sector and my paychecks (bi-weekly) dump a good $500+ each paycheck into the pension. I also have ~$800 going into 401k contributions each paycheck. I make just over $100k a year. Am I over contributing to retirement? Should I do less and invest into other things with this amount? Do I even bother with 401k? Thanks for the help!,1671474713.0
I plan on moving out on my own,3,zpo40a,budget,https://www.reddit.com/r/budget/comments/zpo40a/i_plan_on_moving_out_on_my_own/,7,Hello! I (21F) am planning on moving out on my own. I struggle with finding a roommate and all that plus never had good experiences on finding good people. Does anyone have advice for budgeting when living on your own. For the first few months my parents offered to pay but after that I'm on my own.,1671446065.0
New to Budgeting.,16,zp2g84,budget,https://www.reddit.com/r/budget/comments/zp2g84/new_to_budgeting/,17,"I (21F) am kind of late to being an adult. I just been sheltered by my toxic parents but I'm finally able to get free from them and move out. I have had many jobs but my biggest issue is learning to budget and save. I suck at it. I have depression and possibly Bipolar. Sometimes when something bad happens in my life (basically everyday) I end up spending money. Usually I spend it on food since its hard to get food from parents. But all my money is gone usually due to it. I'm not allowed to cook, not because I'm bad at it, but because they just don't want me to use the kitchen.",1671381174.0
Tips for finding affordable housing?,7,zp60qc,budget,https://www.reddit.com/r/budget/comments/zp60qc/tips_for_finding_affordable_housing/,5,"I can’t find anything 2 bed room under $2k a month in my area. Central/South Fl What are some tips and trick to find cheap housing? 


And no I’m not moving towns or states",1671391314.0
Best way to budget as a server,10,zoh7g3,budget,https://www.reddit.com/r/budget/comments/zoh7g3/best_way_to_budget_as_a_server/,8,"As stated in the title, I am a waitress, so I get paid every day and it’s never the same. I’m currently 22 with no car, no college education, and no savings after moving to a new apartment. What is the best way for me to budget and start saving money? I have the normal expenses of bills, groceries, etc. Except i don’t have to get gas, but i do usually have to uber once or twice a day which is getting expensive. Any help would be appreciated!",1671313638.0
Did you guys change any payment due dates to end of the month before you start budgeting?,3,zoqlx3,budget,https://www.reddit.com/r/budget/comments/zoqlx3/did_you_guys_change_any_payment_due_dates_to_end/,11,"Hello everyone,

We’re in a huge trouble and trying to fix it. Long story short, we have some payments for the 1st week of the month. $485 for the rent ($1937 per month), $500 for the car loan, and $190 for the phones and lines. Not only these expenses, but also I have expenses to be paid in the 2nd and 3rd weeks of the month.

So, my question is if you guys talked to the companies and get your due dates changed to the last week of the month before you started budgeting? I think it would be better for us if we didn’t pay these expenses the right at the 1st week of the month. 

Thanks in advance!",1671340007.0
"I get paid every 4 weeks, but my partner gets paid at the end of every month. With our income never coming in on a set day, what’s the best way to budget?",12,zmekh5,budget,https://www.reddit.com/r/budget/comments/zmekh5/i_get_paid_every_4_weeks_but_my_partner_gets_paid/,10,"Pretty much as the title says, I’m not sure whether to budget for the 4 weeks or to create a budget for the weeks between my payday to her’s. Any advice?",1671086994.0
How much should I spend a month on groceries?,2,zmcnxn,budget,https://www.reddit.com/r/budget/comments/zmcnxn/how_much_should_i_spend_a_month_on_groceries/,10,"I am about to graduate college and am trying to plan a budget for after school. However, I have no idea what I should be planning to spend? How much does a single adult spend on groceries, clothes, ect? Any advice on these categories or others would be wildly helpful.",1671080460.0
Budget Binder Questions!,8,zlfl2j,budget,https://www.reddit.com/r/budget/comments/zlfl2j/budget_binder_questions/,2,"Hihi! I’m currently revisiting the idea of using a budget binder (cash envelope) system for my finances.

The questions are for those who use something similar : 
- How often do you visit the bank? 
- Do you find this causes issues at all when most things, like bills and paychecks, are automatically deposited and withdrawn from your account?",1670986891.0
Anybody got any good advice for my budget?,1,zkw770,budget,https://www.reddit.com/r/budget/comments/zkw770/anybody_got_any_good_advice_for_my_budget/,6,"I have worked out my expenses and worked out my outgoings. Each month I separate money into different pots, that money is for that pot. I am the sole earner in a family of 4, I try to budget fairly the amount of money me and my partner can afford to spend a week (it’s not a lot) but we always seems to go overbudget and have to use money from our different pots. Anyone got a better way to budget for a family of four?",1670939373.0
HOW CAN YOU BUDGET WIYH NO BUDGET??,0,zl1fup,budget,https://www.reddit.com/r/budget/comments/zl1fup/how_can_you_budget_wiyh_no_budget/,6,,1670952649.0
What are good budgeting apps?,12,zjzgy7,budget,https://www.reddit.com/r/budget/comments/zjzgy7/what_are_good_budgeting_apps/,25,"I know YNAB, Every Dollar, and Mint.

What others are out there that may be better for personal budgeting?",1670852586.0
Tracking Travel Spending for Research Purposes,1,zk8loa,budget,https://www.reddit.com/r/budget/comments/zk8loa/tracking_travel_spending_for_research_purposes/,0,"It seems that there are a few threads here focused on budgeting applications, but I had a quite specific purpose in mind that I didn't know if anybody could help with.

I am conducting university research on tourism value chains in Sri Lanka, basically looking at where tourist dollars end up. As a part of this I was hoping to find volunteers to self-report their expenditure on holiday in the country for a few days.

I am interested in how much foreign companies / owners potentially extract from each tourist dollar spent, in addition to how far dollars go in generating inclusive growth in local communities.

Given I am asking people on holiday to self-report their spending I want to make it as easy as I possibly can for them to track their spending for a few days for me!

As such, are there any apps people would recommend for tracking travel expenditure in a format that could then easily be shared with me? Maybe there's functionality that would allow me to see all their entries without them having to screenshot anything for example or do any extra leg-work?

Any input or advice you're able to give would be much appreciated :)",1670872967.0
Question about variable income,6,zhyyqg,budget,https://www.reddit.com/r/budget/comments/zhyyqg/question_about_variable_income/,14,"I am trying to set up a budget for my husband and I. The challenge we are having is that his business is selling things on eBay. The amount of money he brings in month to month varies by thousands of dollars.  Also, our expenses very significantly as we have several children and some months they need several hundred dollars of help and other months they are doing well and living independently. 

How do we effectively and accurately set up a budget when we have those circumstances? 

Thank you.",1670695286.0
"Is there a tool where I can manually enter budget, track investments, crypto, indexes and always get up-to-date price?",0,zhsiip,budget,https://www.reddit.com/r/budget/comments/zhsiip/is_there_a_tool_where_i_can_manually_enter_budget/,4,,1670678711.0
"I created a budgeting consulting company, how much would you pay?",4,zh9lzn,budget,https://www.reddit.com/r/budget/comments/zh9lzn/i_created_a_budgeting_consulting_company_how_much/,28,"Over the years I’ve developed a knack for good budgeting which has led me to be able to truly take control of my life with my money. I found out that I used that to help a few friends successfully and now want to expand to anyone who is willing to find my page to sign up for a one on one consult to help people build a budget. How much would you be willing to pay for a 30 minute video call to walk you thru a budget to fit your lifestyle? Name your prices you’d be willing pay to get a full budget, a plan for savings, debt elimination, and investing plan. Thanks!

Edit: link to site https://7thstorm.square.site",1670622095.0
I need help with a budget,5,zgpcaf,budget,https://www.reddit.com/r/budget/comments/zgpcaf/i_need_help_with_a_budget/,5,"The place i work has same day pay. I got kicked out of my house and had to move in with my boyfriend and his family. I need to get my own place. I struggle with keeping money. I pull out however much I make in a day everyday I work. I make about 86-102 dollars in a shift. I usually spend that in a day after work between food, cigarettes, personal care, extra. I get paid bi weekly. Idk how much I should save in order to get enough to stretch it until that 2 weeks is ready. I wanna be able to go two weeks without pulling my money out so I can get a full pay check on pay day but I need to save up enough money to be able to go that two weeks. Im lost and don't know where to start please help me come up with some ideas. I have to get out of this house my boyfriends mom is very toxic and you have to walk on eggshells around her and I just cant take it anymore so please help me try to figure how to do this",1670568006.0
Which budgeting method is better?,1,zgtsh1,budget,https://www.reddit.com/r/budget/comments/zgtsh1/which_budgeting_method_is_better/,25,"If you have time, let me know why in the comments

[View Poll](https://www.reddit.com/poll/zgtsh1)",1670582353.0
Do meals and merchandise purchases during travel fall under restaurants or travel?,3,zg2pxw,budget,https://www.reddit.com/r/budget/comments/zg2pxw/do_meals_and_merchandise_purchases_during_travel/,26,"I am creating a spreadsheet that tracks and categorizes every single purchase that we make.

I get this might be a subjective thing and it may be just pick one method and go with it, but how do people generally account for meals and general merchandise purchases during travel?  

I have a ""Restaurants"", ""General Merchandise"" and ""Travel"" expense categories.  Hotels go under ""Travel"".  Should I also put meals  and purchases on trips under ""Travel""? Interested to hear your thoughts.",1670514635.0
Wallet App recomendations?,2,zg6iv7,budget,https://www.reddit.com/r/budget/comments/zg6iv7/wallet_app_recomendations/,1,Does anyone have any recommendations for any android apps that function as a wallet App and gives any statistics/data for you've been spending your funds on.,1670523051.0
Split one receipt into different categories (App),8,zfv2hq,budget,https://www.reddit.com/r/budget/comments/zfv2hq/split_one_receipt_into_different_categories_app/,2,"As a side project I’ve been working on a tiny little free iOS App that lets you choose a picture of a receipt and then split the different transactions for different categories (or people) and sum them up: [SplitBill (TestFlight)](https://testflight.apple.com/join/xONM7AyK).

There’s not much too it, and it’s not perfect, but I’m hoping some people here will find it useful. 

https://i.imgur.com/Z9qc24U.jpg

All you have to do is add cards (you can give them category names), select one at the bottom and then tap any highlighted number on the receipt, that will add it to the current card and sum it up.

It should work on any iPhone with iOS 16.",1670494631.0
Student Loan in YNAB,1,zfyks8,budget,/r/ynab/comments/zfxzac/student_loan_in_ynab/,0,,1670505243.0
[Crosspost] Costco Membership Giveaway in r/Povertyfinance,10,zfce8p,budget,https://www.reddit.com/r/budget/comments/zfce8p/crosspost_costco_membership_giveaway_in/,0," Hi! I'm [u/AMothraDayInParadise](https://www.reddit.com/u/AMothraDayInParadise/) and with the kind permission of the mods here, we're letting folks know that over in [r/povertyfinance](https://www.reddit.com/r/povertyfinance/) we are giving away 500 Costco Memberships to folks in the US, Canada and the UK right now! With the help of [r/CommunityFunds](https://www.reddit.com/r/CommunityFunds/) we were given a grant to help with food insecurity and to do a small celebration. You can find the post [here](https://www.reddit.com/r/povertyfinance/comments/zdd18x/povfs_great_big_15_million_subscriber_giveaway/) along with instructions on how to enter. There's no strings attached, come the 12th of December, we'll start passing them out to folks! So come on over, put your name in for one and if you're one of the 500, hopefully this'll help you and yours in the coming year!",1670444211.0
