title,score,id,subreddit,url,num_comments,body,created
Emergency Cash: How To Generate Quick Cash In an Emergency,1,ybplx0,budget,https://www.reddit.com/r/budget/comments/ybplx0/emergency_cash_how_to_generate_quick_cash_in_an/,0,"**Growth is not accidental neither is it a miracle, but the result of the right application of revealed principles and means.** 

Saving money and growing it doesn't have to be difficult. By following a few simple steps, you can easily grow your emergency fund and reach your financial goals. Here are a few tips to get started: 1. Determine how much you need to save each month. 2. Set up a budget and track your spending. 3. Automate your savings so you don't have to think about it. By following these simple steps, you can easily reach your financial goals and grow your emergency fund. Try it out today!",1666550854.0
Rate My Budget,7,yb7i51,budget,https://www.reddit.com/gallery/yb7i51,4,"Rate 1-10 (1 low/10 high)

A regular campaign budget, and a lower income summer budget. Feedback is much appreciated.",1666497717.0
question about ways to tackle my debt?,2,ybbb3m,budget,https://www.reddit.com/r/budget/comments/ybbb3m/question_about_ways_to_tackle_my_debt/,1," 

Hi everyone!

This is my first time posting so i hope someone can help. I just budgeted my yearly expense and how much i owe. Good news i can pay it all off within a year if i stay consistent and not over spend my weekly budget!

My question is should i pay my creditcards with the highest apr first or the highest balance. i have tally for 3 of my credit cards which is my highest balance but 2 more that isnt only tally and there apr is both about 22-23%.

I know everyone goes about this differently but i want to know the most effective way . i have not calculated apr since im not really sure how to so i ended up calculating just all my debt is at the moment.",1666510460.0
Should I pay down debt or save for emergency fund first,13,yara2g,budget,https://www.reddit.com/r/budget/comments/yara2g/should_i_pay_down_debt_or_save_for_emergency_fund/,24,,1666454129.0
"We're about to start building a budget application/software from scratch, let me know your needs",1,yatvhu,budget,https://www.reddit.com/r/budget/comments/yatvhu/were_about_to_start_building_a_budget/,1,"Hello Guys,

We are a team of indie developers who love the topic of personal finance and are about to start building a web/mobile application that can be used for budgeting and personal cash flow planning. What are you missing from current apps on the market? Please let us know your ideas.

Thanks,

Marc",1666460590.0
Helping family members lower energy costs,7,y9zoab,budget,https://www.reddit.com/r/budget/comments/y9zoab/helping_family_members_lower_energy_costs/,13,"I'm going crazy because my wife NEVER turns off the lights! I can only remind her so many times before it becomes nagging. She knows it costs money, knows it costs the environment, and is a very intelligent person, but it's just like she has a mental block on turning off lights or closing doors to drafty areas. What non-nagging methods have worked for you?",1666373921.0
First time on bi-weekly pay schedule…,1,yacrw9,budget,https://www.reddit.com/r/budget/comments/yacrw9/first_time_on_biweekly_pay_schedule/,13,"Let me lead all of this by saying that I am incredibly blessed to have the job I have and any bother associated with pay schedule is a great problem to have in the grand scheme of things.

I may be alone in this, but, as a salaried employee, 26 pay periods per year is NOT my favorite… Can anyone explain why employees would prefer no-weekly over semi-monthly???

For context, I’ve only ever been on semi-monthly payment plans before (always paid twice every month on the same days of the month), and it is wonderfully predictable. Every month I can afford, or not afford, the exact same things.

On this new budget, I basically see three ways to go:

1) Pretend my “lower” average payments are all I make and treat the “extra” two payments as happy surprises for savings. I don’t like this at all personally.

2) When I get an “extra” payment one month, squirrel it away, divide it by six, and every following month add 1/6th to that month (I’m too particular I know I can’t help it). I lean towards this, especially as December will be the first applicable month and I can start cleanly with the new year.

3) Build that extra paycheck into my savings plan and deposit less into savings each month. Not my favorite, as this ignores the possibility of job loss (incredibly unlikely, but still) or unexpected events.

Thoughts, genius budgeters of Reddit?

Cross-posting in Aspire Budget",1666408984.0
9 Tips that have Saved me some Cash,13,y8z6s1,budget,https://www.reddit.com/r/budget/comments/y8z6s1/9_tips_that_have_saved_me_some_cash/,0,"If you are feeling the burn OUTSIDE of the gym, you might be a victim of inflation nation. Let’s talk tips to keep a few, or maybe even many, extra dollars in your pocket. You earned it, don’t give it all away.

The Big Three

When talking about saving money, there are thousands of little things that can save you a buck or two, but you may be better served by looking for the bigger wins.

My first 6 tips come from what I am going to refer to as the “BIG THREE”: Housing, Transportation, and Food. On average, these three categories tend to take up a good portion a monthly cashflow.

ROOMMATES Nothing says “I’m an adult” more than having your own place. Well, except maybe being able to pay your bills. Especially in locations where rents are high, adding a roommate to your household can be a huge win. For all my fellow introverts out there, I know it can feel like a big sacrifice, but adopt a roommate you really love, or one who has a different schedule than your own. You might find you have the place to yourself more than you anticipated. I know this is a change that might be hard to make today, or even within the next few months, but keep it in the back of your mind as your lease comes up for renewal. (SAVINGS $400-$500/mo.)‍

TRANSPORTATION Even as we see a bit of a break in the gas price surge, it’s always a good idea to evaluate your transportation practices. If there is little flexibility in your options to get to work, like carpooling or biking, there is still probably some dollars to be saved on nights and weekends. Get thoughtful with your errands so you can knock them out in one trip rather than a nightly ride in the gas guzzler. For my city folk, skip the cab, and learn a new bus route. (SAVINGS $15-$40/mo.)‍

GROCERY STORE For those who don’t know, this is the place where you buy food to bring into your home, and then you can eat it whenever you want. Most of the time it’s cheaper, too! Get that store savings card, make a list, and look for products you enjoy that happen to be on sale this week. Even if, like me, you’re a creature of habit, don’t be afraid to choose a new brand of peanut butter if it’s going to save you a few bucks! (SAVINGS $50-$100/mo.)

Ok, I know the grocery store might not be as exciting as checking out all the newest culinary delights, so let’s get into some money savers when dining out. ‍‍ WHERE ARE YOU EATING?: There can be a big monetary difference between full service restaurants and places where you order at the counter. DO NOT save extra money by being a bad tipper! If you are choosing to eat at a restaurant with a waitstaff, calculate that extra 20% (or more) in your brain before you enter the door. If it’s going to be too much of a stretch to tip, be kind to our friends in the service industry and come back when it’s more doable. (SAVINGS $50-$200/mo.)‍

RESTAURANT EXTRAS: You can have a great experience, get a good meal, and be a generous tipper without having to break the bank. Restaurants love to catch you with the extras. Opt for water over alcohol or soda, share an appetizer, and maybe skip the meat tonight. You’d be surprised how much you can reduce the bill by choosing just one of these alternatives. Or do all three. (SAVINGS $50-$200/mo.)‍

FREQUENCY: If you are eating at restaurants every night, you might find the novelty wearing off quick, and your paycheck disappearing even quicker. Try to space out your trips to restaurants and maybe replace them with date nights cooking at home. If you are wondering where the food will come from, see above: (GROCERY STORE). (SAVINGS $50-$250/mo.)

‍Ok, let’s wrap this up with a couple of miscellaneous items outside of the big three. ‍ SUBSCRIPTIONS: If you are scrolling your subscription menus more than watching the content, it may be time to eliminate a service or two. If you want to go one step further, pull out those credit card statements and see if you have forgotten to cancel any subscriptions you no longer use. (SAVINGS $15-$100/mo.)‍

CLOTHING: Before you plan another shopping trip, take a deep dive into your closet and take stock of what you own and the frequency in which you wear your items. Remove things you doubt you will wear again and get yourself to a second hand store. (Trigger warning: selling your clothes at certain second hand stores can cause you to question all of your life choices.) If they decide your items are worthy of purchase, they usually offer you cash or store credit. Take a look around and your 5 unworn pieces might turn into your new favorite vintage shirt! (SAVINGS $15-$30/mo.)‍

CELL PHONE: “Hello? Can you hear me?” There is a lot of money to be saved here. With just a bit of research and no change in habit I was able to reduce my monthly cell phone plan from $118 to $35. Check out your previous data usage and question the need for the unlimited plan. WIFI is EVERYWHERE. Ask if your provider has a cheaper prepaid plan (all you’re really doing is paying on a different date), and try to take advantage of any loyalty programs. If you’ve exhausted all efforts, threaten to leave. It’s funny how often a new offer will suddenly “pop up” in these instances. Also, just because we have been placed into a system with a standard 2 year payment plan, does not mean you need to upgrade your device on this schedule. Think of your cell phone like a car: if it has a bad battery or a shattered windshield, replace the parts, not the whole! (SAVINGS $20-$80/mo.)

I believe if you take advantage of just a few of these tips, you might be surprised at how quickly you can free up between $150-$300/mo. without too much sweat.",1666274713.0
Is there a site like hotukdeals but for people inside the european union or austria in particular?,2,y98crr,budget,https://www.reddit.com/r/budget/comments/y98crr/is_there_a_site_like_hotukdeals_but_for_people/,3,,1666296178.0
Budget,3,y90v3k,budget,https://www.reddit.com/r/budget/comments/y90v3k/budget/,2,"How much does one have remaining after rent, utilities, groceries transportation, and taxes are accounted for? Does not include outings, takeout/dining, fun money, or home needs/shopping? And what’s your annual salary to correlate to that",1666278760.0
2023 Budget in the Works,12,y8kn09,budget,https://www.reddit.com/r/budget/comments/y8kn09/2023_budget_in_the_works/,1,"https://docs.google.com/spreadsheets/d/1Nqmn9NfUXUh2seBrn4OxzDAJxbJ7jG5Imx79U-n1MTs/edit?usp=sharing

not super complex but i tried to make it look nice and give fall vibes. I put in dummy numbers just so people could see how it works. open to suggestions :)",1666229787.0
looking to add solar to my home in Gulf coast Central Florida tampa and have a few questions. What should I be looking for in a company and what are some red flags. Not much knowledge on my end other than we have no shade and a south facing roof so should be able to finds good savings right?,1,y8qhlz,budget,https://www.reddit.com/r/budget/comments/y8qhlz/looking_to_add_solar_to_my_home_in_gulf_coast/,2,,1666247220.0
Help,1,y8mlj4,budget,https://www.reddit.com/r/budget/comments/y8mlj4/help/,9,"Hi! I need help with how to budget. I have a bad habit of burning money like it’s nothing and it’s bad. I would like to know how to  stop that and save. When I see money that means I can spend, but how do you get over that mental hump that is actually not there to be spent but saved. Idk if I sound like an idiot or brat… I just want to be good with handling money.",1666235255.0
Need Advice - I always lose budget motivation in the second half of the month,11,y7np31,budget,https://www.reddit.com/r/budget/comments/y7np31/need_advice_i_always_lose_budget_motivation_in/,5,"Every month I am excited to start fresh and tell myself this will be the month that I'm really on my game with budgeting. For the first couple of weeks I'm excited and motivated and on track. Then, inevitably, around the middle of the month, I lose all motivation and get off track and dip into my savings. Then it becomes just spending mindlessly until the end of the month when the cycle starts again. 

Does anyone have any advice/insight?",1666139230.0
Suggestions for budgeting with multiple account?,2,y7o81a,budget,https://www.reddit.com/r/budget/comments/y7o81a/suggestions_for_budgeting_with_multiple_account/,3,"Hi all, 

I've been using Mint for some time but I'm finding that it doesn't accurately calculate my monthly totals so I'm switching to good old Google Sheets. I have it set up for my debit account but I'm wondering how folks track other accounts - like credit cards and how they input those against their main account.

&#x200B;

I'm also looking for tips for budgeting when a yearly purchase is made (ex. Home Insurance). These are things that I found Mint doesn't do a great job with and I'm looking for suggestions on how I can better track this in my Google Sheet. 

&#x200B;

Right now I have a tab for Expenses and one for Income - both for my main account. I'm thinking of adding two more tabs CC - Expenses and CC - Payment but adding it to my Summary page would take a bit of food (using the Google Budget template and it doesn't like those kind of changes). 

Welcoming any and all suggestions!",1666140682.0
Budgeting as a teen,10,y6u4v6,budget,https://www.reddit.com/r/budget/comments/y6u4v6/budgeting_as_a_teen/,10,Hey! I wanna learn to budget but I really don’t have any bills. I basically only pay for gas and groceries. But I want to learn to budget so I can save money for the future.,1666059828.0
How’s my budget look? I’m open to suggestions :),6,y6us3l,budget,https://www.reddit.com/r/budget/comments/y6us3l/hows_my_budget_look_im_open_to_suggestions/,4,"I am hourly, not salary. I make $30.27 an hour and $31.50 an hour when I work night shifts. I do make an average gross pay of $5500 per month or a bit higher.

*Mortgage: $1283. I do pay a little extra and my partner gives me $600 towards it also. 

*Car: $550, yes this is high but I chose to select a shorter payment plan. I pay $600.

*Groceries/Restaurants: $600 this number seems high to me but I guess it’s not that high with inflation. I also like to take my brothers out to eat every now and then.

*Miscellaneous: $600.. I used to give myself a lot less. This is used for clothes, house stuff, entertainment, gift giving any I don’t use I put towards either extra savings or an additional principal only mortgage payment

*Gas: $250 I have a 35 minute commute to work one way.

*Savings: 300 I don’t save as much as I used too I used to save a lot more but I decided to put more money to my mortgage and 401k. (Pre tax) 

*Electric: $70-200 it really fluctuates but I put aside $200 every month just in case. 

*Furniture: $200 a month.. I just bought two new couches, and side tables and a coffee table. I also got a 6 piece bedroom set because the one I had was 13 years old and starting to really fall apart lol. It definitely held up for me… this in total was $2500 that I put on a 15 month 0%apr card. This is my only balance on the card. I did this last month and I’ve been making additional payments it’s at $1770 now. 

*Car insurance: $113 is what the monthly breakdown would be but I pay 6 months at a time for full coverage and $500 deductible for a 2022 Kia K5

*Sewer: $30 average 
*Water: $20 
*Trash: $17.48
*Apple Music/ICloud Storage: 10.99
*Peacock: 4.99

Some misc information:
I contribute 6% to my 401k and my employer matches that 6%  My employer also provides a pension.

My dad covers my phone bill I used to pay him for it but he said I can count it as my birthday every year.
I do not pay for internet I bought a device that allows me to stream shows from my IPhone. I don’t watch a lot of tv when I’m off work because I do a lot of stuff with family and friends.

I apologize for the formatting I did this on my cellphone.",1666061649.0
Our Budget Set Up (GoogleSheets),24,y6gsvd,budget,https://i.redd.it/ed23yem1geu91.jpg,12,,1666027004.0
How do you handle cash/ATM withdrawals in your personal budget?,2,y6gfps,budget,https://www.reddit.com/r/budget/comments/y6gfps/how_do_you_handle_cashatm_withdrawals_in_your/,7,"I am having a hard time doing the mental math to figure out the best way to track my cash spending. 

On the one hand, ATM withdrawals show up in my bank statement and lower my overall amount, which means I want to log them as withdrawals in my personal budget so that I know how much money I have available. 

However, I also want to track how much cash I'm spending and where I'm spending it, so I log those as transactions as well. But this means I'm double-recording the amount that I've spent, making my budget balance lower than my actual balance. 

But when I just log the ""withdrawals"" as expenses in my budget and keep a separate column for my cash transactions, I am no longer able to easily check that I'm spending the amounts I want in the areas I want (recreation, laundry, etc). 

Do any of you have a cash system that you like to use? I use cash pretty regularly and would like to figure out how to handle this - otherwise I tend to get frustrated and abandon budgeting altogether.",1666026129.0
Good Reloadable Debit Card,2,y6drss,budget,https://www.reddit.com/r/budget/comments/y6drss/good_reloadable_debit_card/,9,Does anyone have any recommendations for a good reloadable debit card. I basically want something that I can auto deposit a couple hundred from my bank every month. I'd like zero fees and accepted basically everywhere. Is there any good cards or anything I should consider?,1666019922.0
Has anyone tried the GroupBudget app?,0,y681y7,budget,https://www.reddit.com/r/budget/comments/y681y7/has_anyone_tried_the_groupbudget_app/,2,"My girlfriend and I have always used Splitwise to manage our shared expenses but have always found it annoying that it doesn't give me an easy way to categories our expenses and manage our budget.

I recently came across [https://www.groupbudget.app/](https://www.groupbudget.app/) which looks really promising. Has anyone here tried it?",1666004417.0
Looking to budget together with my gf,3,y5zfd8,budget,https://www.reddit.com/r/budget/comments/y5zfd8/looking_to_budget_together_with_my_gf/,10,"I usually do my own budgeting and expense tracking using spreadsheets. Now that my gf and I am planning to budget together as a couple, I am hesitant to ask her to get all entire bank statements.

Wondering if there are any budget or expense management tool focused for couples. Please don’t say joint accounts, we are yet not in that stage of our relationship yet.",1665974912.0
How to budget a varying income?,8,y5pmmy,budget,https://www.reddit.com/r/budget/comments/y5pmmy/how_to_budget_a_varying_income/,3,"I earn a set hourly rate at my job, and I’m supposed to work 29 hours a week, but sometimes I’m a few hours under or over. I get paid once a month. I also am not sure how to estimate for taxes taken out. 
How can I budget?",1665948792.0
How to budget gifts of money received?,1,y5gnll,budget,https://www.reddit.com/r/budget/comments/y5gnll/how_to_budget_gifts_of_money_received/,4,"Hi All,

I've been very carefully budgeting on a spreadsheet over the past year or so and am trying to improve my process. Recently, I received a gift of money from a generous relative to go toward investments, and I'm trying to determine how best to reflect this on my budget sheet. 

At the moment, my budget includes just my salary and any money I earn from side gigs or jobs. In the past if my grandma gave me $20 for gas or something, I'd include that, too, under an ""other"" category. But I'm not sure what to do with, say, a few thousand dollars given to me by someone, as well as any future inheritances etc.

I like being able to see exactly what I'm earning through work and what I'm doing with those earnings. Not that any money received isn't mine, but I feel like it would sway the budget and not make it as realistic, if that makes sense? Maybe this is a separate thing, actually, where I have a budget of my job earnings + all spending but can calculate networth differently?

Looking for any tips and suggestions anyone might have! Thanks!",1665926370.0
May I post a quick survey about personal finance / budgeting? It’s for school. Thx,2,y53gg7,budget,https://forms.gle/fbXSg4DtpQZoo1Sv8,1,,1665881498.0
PLEASE take my survey about Managing a Budget,1,y567fu,budget,https://www.reddit.com/r/budget/comments/y567fu/please_take_my_survey_about_managing_a_budget/,0,thank you! [**https://forms.gle/fbXSg4DtpQZoo1Sv8**](https://forms.gle/fbXSg4DtpQZoo1Sv8),1665890060.0
Budgeting software,1,y30mbc,budget,https://www.reddit.com/r/budget/comments/y30mbc/budgeting_software/,5,"What is the best way to keep track of a budget? Is it an app? Website? Paper and pen?

Thank you!",1665672439.0
Budgeting App Recommendations?,2,y2lptu,budget,https://www.reddit.com/r/budget/comments/y2lptu/budgeting_app_recommendations/,1,"I'm looking for a budgeting app that's easy to understand - I've tried a couple in the past that were so complicated I couldn't use them. I am particularly struggling with the pressure of paying off credit cards so I am looking for something I can track credit card amounts I have left to pay, input paychecks or costs, make budgeting goals, etc. Idk if something like that exists but thought I would ask lol",1665624649.0
Subtraction Budget App? Need Recommendations,3,y2c03h,budget,https://www.reddit.com/r/budget/comments/y2c03h/subtraction_budget_app_need_recommendations/,5,"I've searched high and low for an app like this. I don't want a spreadsheet, I don't like INAB app, pretty much no automated app works well for my wife and I b/c we're self employed and it gets complicated. 

I want an app we can both use and it subtracts what we input. 

Example:

Our monthly bills are $3000. $1500 is reoccurring (ie: rent, insurance, health insurance, car payment.. etc. The majors.

$1500 to track minors resets every month with a history that either says -x or +x.

October 1st it says $1500. This is established number that is post all Major monthly bills.

I buy mcdonalds. I open app, type $9.20

boom updates to $1490.8

Wife buys gas. $40

boom $1450.80.

&#x200B;

Hopefully this makes sense. It's an incredibly simple concept, I just can't find a way to do it easily without google sheets or something that's a little complex on our phones.",1665600515.0
First full time job post college,2,y1ovnj,budget,https://www.reddit.com/r/budget/comments/y1ovnj/first_full_time_job_post_college/,11,"Sorry I’m advance I’m on mobile. Like the title says I am about a week in to my first full time job post college. My parents were not the best example growing up, and while my partner(m24) and I (f24) are by no means wealthy we are comfortable enough to provide for us and our dog. The most experience I have with financial literacy was a short class we were required to take in high school, and my mother trying to preach and shove Dave Ramsey down my throat. What is some advice, or things to be aware of when it comes to budgeting for us? What have you guys found most useful? Any advice and resources are welcome!",1665533859.0
"How to incorporate large, infrequent transactions in a budget?",10,y11k44,budget,https://www.reddit.com/r/budget/comments/y11k44/how_to_incorporate_large_infrequent_transactions/,12,"Is there a good way to keep track of large, infrequent transactions in a budget? For example, I recently bought a new bike for $5k. This is an expense that I only have every \~5 years or so. Should I have a budget for a new bike every 5 years? Is there a good way to keep track of this? How do other people do it?",1665469331.0
Budgeting at work,6,y0hr5g,budget,https://www.reddit.com/r/budget/comments/y0hr5g/budgeting_at_work/,10,Any suggestions for easy way to manage my budget at work? I have 7 accounts (I'm a Marketing Director). Not only expenses but credit also. I really struggle with Excel as I've never had to use it before. Willing to pay a little a month. Thank you,1665416009.0
Is it good to have $700 left after monthly expenses?,27,xx6h84,budget,https://i.redd.it/f5zfa7fs27s91.jpg,20,,1665066074.0
Zillow partnering with Transunion AKA your credit file,1,xx8vl7,budget,https://www.reddit.com/r/budget/comments/xx8vl7/zillow_partnering_with_transunion_aka_your_credit/,0,I just noticed they are pulling from my credit file to display my remaining home mortgage balance on their site. Update; I realized they are spitballing this number taken from an average number of homeowners. Still annoyed by the intrusion into this part of my finances.,1665072127.0
guys I need help finding a app to manage bills?,6,xwdg7x,budget,https://www.reddit.com/r/budget/comments/xwdg7x/guys_i_need_help_finding_a_app_to_manage_bills/,7,"So guys I already use Marcus to manage all my checking, saving and investing accounts. So I just need an app to link all my bills I pay to keep everything in one place please help?",1664983244.0
