title,score,id,subreddit,url,num_comments,body,created
App to help with a particular type of budgeting,1,vfvgwt,budget,https://www.reddit.com/r/budget/comments/vfvgwt/app_to_help_with_a_particular_type_of_budgeting/,2,"So far I've seen Mint and other apps to help with budgeting monthly income and the sorts. I was wondering if anyone knew an app or website that budgets one time things. For example, say I got $1000, is there an app where I can split this 1000 and allocate it to different things and it deducts money as I spend? it doesn't need to be connected to my account",1655646142.0
I really need some advices 🥺✌️ thank you very much in advance!,2,vf98gr,budget,https://www.reddit.com/r/budget/comments/vf98gr/i_really_need_some_advices_thank_you_very_much_in/,7,"Hey hey 
Sorry that is so long but I didn’t knew how to write it shorter 🥺
Basically I’ve never had a some financial education or some good financial example in my family cause we lived in a poor country in East Europe and were basically living on a bare minimum.
I moved to Europe at 18 y.o. and started to earn money but also spend it on everything I could buy and wanted to buy since I was a child, I think some kind of trauma.
I was also taking loans that I am paying till now. I know I was really foolish and stupid.

So about my situation a lil bit: I am a full time student with a mini-job. 
My parents also help me to pay the rent.  
Basically I have every month from ~1200 till ~1400€.

My fix bills are:
-Rent 600€
-Insurance 110€
-Phone 110€
-Gym 25€
Total 845

Also every month I give around 100€ for my credit cards. One is in -1500€ and other one is in ~600€. 

So now the total is 1.045€.
I’ll be left with 255€ if I become an average of 1300€.

My question: is it possible somehow with such a low income to even save some money and buy groceries and the minimum bathroom supplies? 
Or maybe anyone has some advice to pay my credit cards really fast? 

I have really bad sleeping problems and anxiety because of this and I don’t wanna ask for more money from my parents. 

Maybe someone has some advices??

Thank you very very very much for reading till the end and also thank you very much in advance for your tips 🥺❤️",1655568121.0
Hi all! I am new to budgeting and I need help to set up a system for my 4 day on 4 day off work schedule,1,vf77j5,budget,https://www.reddit.com/r/budget/comments/vf77j5/hi_all_i_am_new_to_budgeting_and_i_need_help_to/,6,"I am currently trying to save to rent my own 1bed apartment. I work a low paying weekly pay job but the work schedule is 4 days on-4 days off 12hours shift. As a result sometimes my pay for the week is only for 3 days. I do get 15-16 days work consistently every month so I can roughly  estimate my income for the month. However I need help to setup spending budget for the 8 days work rota. Especially between 2 months.
Thank you for all or any help in advance.",1655561938.0
BE CAREFUL with your personal data,19,verl18,budget,https://www.reddit.com/r/budget/comments/verl18/be_careful_with_your_personal_data/,2,"There are many wonderful people offer ways to help which is great and true evaluation requires looking at all your numbers and info

Make sure if you decide to send someone your information you **MUST** block out all personal information. where you live, your bank account and routing numbers, your credit card numbers anything that can tie personally to you... heck i would even block what bank i was dealing with.

I am not in any way saying that any reddit members are bad, just make sure and protect yourself, it is a crazy internet world.",1655504188.0
Help Someone who's Privileged?,2,vel2fz,budget,https://www.reddit.com/r/budget/comments/vel2fz/help_someone_whos_privileged/,8,"Hello all,

Ever since I was around 17 I worked a high paying job. It's a lot of physical labor but back then I got $40/hour and 10 years later I'm still higher in the industry but now I'm making $70-$85/hour.

Pretty much my whole career I have never really stressed about money and I was also never financially responsible. I'm der now so I'm alot more responsible but I still barley know how to budget. 


How do I start? How do I end my bad habit of barley paying attention to what I spend on?

I really want to buy a house but saving is so hard. 


One this I will add that is kinda irrelevant, I'm fairly humble and part of my spending comes from me always paying for other people or giving them money to help them that and also buying weed lol",1655486219.0
Youtube videos or podcasts for someone new to budgeting?,9,ve9q80,budget,https://www.reddit.com/r/budget/comments/ve9q80/youtube_videos_or_podcasts_for_someone_new_to/,6,"I'm looking for resources for a young adult with his first job. He has some reading issues so videos or podcasts are his preferred method of learning. 

Any good suggestions out there for someone brand new to it?",1655460453.0
Youtube or podcasts for someone new to budgeting,5,veage2,budget,https://www.reddit.com/r/budget/comments/veage2/youtube_or_podcasts_for_someone_new_to_budgeting/,4,"I'm looking for YouTube videos or podcasts for a young adult with his first job. He has some reading difficulties so video/audio is his preferred method of learning.

Is there anything out there that goes through not just why budgeting is important, but the nuts and bolts of how to get started? 

(Also apologies if this posts twice. I swear I already posted this but maybe I shut the app too soon).",1655463337.0
Good Australian budget when I have multiple accounts,2,veefwv,budget,https://www.reddit.com/r/budget/comments/veefwv/good_australian_budget_when_i_have_multiple/,4,"I’m looking for a good budget app.

I am with Suncorp and have many sub accounts. Each hold different amounts, I pay fortnightly directly to gas, electricity and water based on the last 2 years averages (how long I’ve been in my rental, I adjust this every financial year). I’m using excel at the moment, which meets my needs.

I’m wondering if there is an app I can link to my accounts which will download data. I do have access to Xero, through my second job…so I could start a company on there and add my accounts then allocate as I do for work, unless there is a better app?",1655476048.0
Anyone else roughly follow the 50-30-20 rule needs-wants-saving?,7,ve22wh,budget,https://i.redd.it/7q8p5k8eb3691.jpg,4,,1655431883.0
For those who need help budgetting,3,vdzhp1,budget,https://www.reddit.com/r/budget/comments/vdzhp1/for_those_who_need_help_budgetting/,0,"I will do a full budget review or budget creation for $one. I have had so many people that need help budgeting and have sent me their budgets or monthly expenses. I would love to help anyone in need, especially stay at home moms and mothers to be. 

What to do:
Send me $1 or more on Cashapp, Venmo, or Paypall. PUT YOUR USERNAME WITH $ SENT. 

DM me your monthly expenses. Literally everything. 

all habits or entertainment:
Groceries, eating out. 
Starbucks, mary J, medications 
Alcohol, nicotine 
Rent or Mortgage
Electricity 
Water
Sewage 
Insurance
Car payment
Credit cards

I will have yours done first, and if anyone needs a budget that doesn’t have the money, then all I will ask for in return is a review. 

We are struggling as well, so this is a way to mutually help one another. I am charging the bare minimum, but I understand every dollar counts sometimes. 

If anyone is interested, please comment and I will drop my cash sending app info.",1655423687.0
advice on making (and sticking to) a budget?,2,vdytr0,budget,https://www.reddit.com/r/budget/comments/vdytr0/advice_on_making_and_sticking_to_a_budget/,4,"Hello, I just started a new job, and I need to Budget so I can get my own place in a couple months. Any advice is appreciated",1655421647.0
"Need a new budgeting ""system""",4,vdqeaz,budget,https://www.reddit.com/r/budget/comments/vdqeaz/need_a_new_budgeting_system/,10,"I grew up poor, in the US, and never was taught how to budget. My way is typically ""pay bills, buy food/gas, hoard the rest except for when we want to do fun things"". Which typically results in little savings, etc, even though we shoud have a great savings built. Income is roughly $5000/month ($2k 1st of the month, then remaining is split bi-weekly), and bills equate about $2000 (not including gas and groceries, etc.). What is your best budgeting app or system? All of our bills are paid online, and it's just my husband and I, both 25 and have ADHD. We know if we pull money out in cash, then we won't touch it (out of sight, out of mind), but I worry if we pull it out then we will overdraft, etc. Any tips or help is appreciated!",1655398229.0
Budget,2,vdtne6,budget,https://www.reddit.com/r/budget/comments/vdtne6/budget/,6,Anyone have advice on how to budget when getting paid monthly?,1655406942.0
Thoughts on my budget?,2,vdpvph,budget,https://www.reddit.com/r/budget/comments/vdpvph/thoughts_on_my_budget/,4,"Been working on this for a few years. Looking for thoughts from the world. This gets updated with all of our transactions at our monthly budget meetings.

[https://docs.google.com/spreadsheets/d/1oKgcNIh\_TcF7Eoy0S3tOFjeZPuIjp4dFbAba\_w6ikM8/edit?usp=sharing](https://docs.google.com/spreadsheets/d/1oKgcNIh_TcF7Eoy0S3tOFjeZPuIjp4dFbAba_w6ikM8/edit?usp=sharing)",1655396815.0
Starting a Teenage Budget,9,vd239x,budget,https://www.reddit.com/r/budget/comments/vd239x/starting_a_teenage_budget/,8,"I am a teenager looking to start a budget. I currently make $15/hour for 30-35 hours a week but only during the summer months, I might work a job at college and that would pay about $8/hour for 15-20 hours a week. What are your suggestions on starting a budget?",1655320016.0
Want to make my own budgeting sheet and not sure where to start,4,vcw7ah,budget,https://www.reddit.com/r/budget/comments/vcw7ah/want_to_make_my_own_budgeting_sheet_and_not_sure/,9,"I (24f) have been in my ""big girl job"" since september. I am also in the midst of paying off a condo. I thought I have been smart about balancing my pay checks and budgeting them the correct way but now as a new financial opportunity, or rather a speed hump, has arisen I have realized I am not doing this the most efficent way. I want, more like need, to make a budgeting spreadsheet and have no idea where to start. So I am seeking advice from the internet! I am just going to list all my questions

What categories should I include? About how much each month do you divy out for your fun money, emergency funds, and other categories? I am a complete newby and want to become more independent with my finances!",1655304465.0
Critique my budget sheet!,5,vcf6wx,budget,https://www.reddit.com/r/budget/comments/vcf6wx/critique_my_budget_sheet/,5,"Just sharing an updated copy of a sheet I found on Reddit. I really liked the setup but it was missing some things and I hated how it calculated some data. 

So take a look and give me any pointers you may have.

https://docs.google.com/spreadsheets/d/1QPzIms7773VaeHSC7jtRKXxCg3z4RJN1POWT18czofA/edit",1655245306.0
How do I even budget when we’re in our overdraft?,12,vbtk94,budget,https://www.reddit.com/r/budget/comments/vbtk94/how_do_i_even_budget_when_were_in_our_overdraft/,8,"I’m a SAHM and my husband works full time. We have both acknowledged that we suck at managing our money and desperately need to learn how to develop and stick to a budget. The problem is, we both have ADHD and extreme trouble getting our heads around where to begin. Even worse, we are deep into our overdraft and basically use our OD to pay for everything (bills, bills, bills.) I’m desperate. Every time I sit down to try and work out the numbers I just cry and feel sick. Is it even possible to dig ourselves out of our OD once and for all?",1655175541.0
"Should I pause investing if I take on an auto loan for a used car? 4.09%? Or take advantage of this bear market? I can put 20k or 30k down, 30k down saves me $500 for the first year in interest.",7,v9ijl3,budget,https://www.reddit.com/r/budget/comments/v9ijl3/should_i_pause_investing_if_i_take_on_an_auto/,14,,1654897905.0
Budgeting App for School,3,v8th5n,budget,https://www.reddit.com/r/budget/comments/v8th5n/budgeting_app_for_school/,1,"Hello everyone!

I am creating a budgeting app for my UX BootCamp.

I am looking for people to take my survey and participate in future user testing!

It should take 1-3 mins.

I would appreciate it!

Survey link: [https://forms.gle/nNTfGqR7FuQSkmZUA](https://forms.gle/nNTfGqR7FuQSkmZUA)",1654815924.0
I’ll make you a budget! For free!,43,v7s0ie,budget,https://www.reddit.com/r/budget/comments/v7s0ie/ill_make_you_a_budget_for_free/,55,"I didn’t know this was an option on here, I thought it went against the rules, but I just saw someone post something similar and I love helping people! I create budgets as a freelancer and I would love to help anyone in the group! (FOR FREE)",1654701421.0
"How do you fill a new apartment with furniture, necessities and decor without going into debt?",13,v7wqil,budget,https://www.reddit.com/r/budget/comments/v7wqil/how_do_you_fill_a_new_apartment_with_furniture/,19,"I just moved into a new apartment after living with someone for a couple years. I have basically no furniture or home goods. I’m at the stage in my life where I’ve gotten rid of all my old, cheap stuff and now have a decent job where I can afford better things. I’m still very frugal though so I am always searching for the best deals and prices.

I’ve already bought quite a few things which I felt were reasonably priced, but my credit card balance is getting out of hand. I’ve been paying it off each month, but I don’t want to go into debt just trying to furnish my new home! How have you guys been able to buy these things and still be able to maintain or grow savings? TIA!",1654713773.0
Best way for a 17 year old to start budgeting.,5,v7ghv6,budget,https://www.reddit.com/r/budget/comments/v7ghv6/best_way_for_a_17_year_old_to_start_budgeting/,6,"I am a 17-year-old who has worked multiple jobs this year leaving me with \~$1500 in savings. I am also making \~$150 a month and plan to start another job once the school year starts again. I want to start budgeting for a car, school, and obviously money to spend on myself. I plan to spend a good amount this summer traveling with not much money coming in. 

This leads to why I am making this post. I want to find a simple (preferably free or cheap) budgeting solution that allows me to budget for the summer as well as when the school year starts and I have more money coming in. I have tried Mint and YNAB. I did not like mint due to the fact that it was clearly geared towards people who have to pay bills and I could not seem to get around that. I did not mind YNAB's concept although I found it confusing especially for the simplicity of what I need to budget for. 

Wondering if anyone has any ideas for me. Thanks!",1654661351.0
Software/Automation Suggestions Please,2,v7cfi2,budget,https://www.reddit.com/r/budget/comments/v7cfi2/softwareautomation_suggestions_please/,4,I’m a bit old school and I’ve been manually tracking/paying/planning for my monthly budget and bills every two weeks when I get paid in Excel. I would love to automate as much of this as possible and get back the 1.5 hours of my life I spend “paying the bills” and “balancing the budget.” What software would you suggest that will make things as easy as possible for me while giving me the choice to make small adjustments where needed when funds are tight or emergencies occur?,1654648700.0
Can’t save money no matter what…,6,v6nd5j,budget,https://www.reddit.com/r/budget/comments/v6nd5j/cant_save_money_no_matter_what/,5,"I have a pretty decent job. But no matter what, one paycheck pays my mortgage and all my house bills like insurance and strata fees. The other paycheck I have to live off. It’s not that much and I matter what I try to do I can’t seem to get out of debt. It seems actually each month I just go further and further into debt. And I make a good wage… I kill myself after all my bills are paid about $500 to live on for gas food and anything else I wanna do. That’s not a lot… Does anybody have any tips for me? I feel like I’m going to be in so much debt is no way out. I have one credit card and a line of credit.",1654579366.0
Looking for budgeting software or a template to copy,2,v5gwjp,budget,https://www.reddit.com/r/budget/comments/v5gwjp/looking_for_budgeting_software_or_a_template_to/,3,,1654446398.0
Buxfer,2,v3oykw,budget,https://www.reddit.com/r/budget/comments/v3oykw/buxfer/,4,Does anyone in this group use Buxfer? I’ve been actively using it and would love to discuss the platform with others.,1654222306.0
Getting out of debt quickly,6,v3euwi,budget,https://www.reddit.com/r/budget/comments/v3euwi/getting_out_of_debt_quickly/,9,"My husband and I have been fortunate enough to stay home with our kids. Thanks to the military he recieves disability and he earned his bachelors online which also provided us income through the GI bill. I also attended nursing school and graduated in May 2021.
With that being said, we accumulated credit card debt. $12k. 
A lot of it just from us living above our means, some of it helped us as well though. 
He's started a new job making $74k, plus he receives disability payments. While I could go to work, the cost of daycare and finding someone I trust isn't possible right now and I'm a firm believer my kids come before anything else. I will be earning my RN-BSN online while staying home though.
We are ready to settle down and make smart choices towards our future. We don't even know where to start when it comes to making a budget or how to make one. We could really use some help. Thanks!",1654192871.0
Decent Phone for $50-60,2,v2sc5w,budget,https://www.reddit.com/r/budget/comments/v2sc5w/decent_phone_for_5060/,10,"I am really on a tight budget here. I have $60 to buy a new phone, and I am unsure what I should get. The budget is not flexible whatsoever. I am either considering a Samsung Galaxy S7 or a Google Pixel 2. I don't need anything super up to date, just something that will run social media apps, not be too slow, and have 32+ GB storage. If anyone has any suggestions, please let me know. Thanks",1654119878.0
Need help creating a budget for the next few months and then after,1,v2we8p,budget,https://www.reddit.com/r/budget/comments/v2we8p/need_help_creating_a_budget_for_the_next_few/,6,"Hi. I recently got an offer for a work from home job that I will be starting on the 27th of June. It pays $16 dollars an hour. I owe $3532 in back rent (April, May, June), and my rent is 883. I am working on a deal with my landlord where I will pay my rent of 883 plus a portion of the back rent until the back rent is paid off. I have a friend who is willing to help with bills with an extra 200 to 300 dollars a month.   
My phone bill is 45 dollars, my internet is $90, my electric is a bit more complicated bc I live in a very old house in Texas and its summer so my bills are getting up to $400 dollars, water is about $160. Groceries I spend about $150 to $200 monthly, if I have to eat super cheap for a few months I can do that. I don't have a lot of monthly subscriptions except youtube premium which I use for music, that's $10 dollars. I can cancel any others.   


Math and budgeting has never been my strong suit, so any help would be appreciated.",1654130678.0
Go into forebearance to buy a Tesla?,0,v2l13o,budget,https://www.reddit.com/r/budget/comments/v2l13o/go_into_forebearance_to_buy_a_tesla/,8,"Hi, we make $200k a year and max out all retirement. Instead of pausing investing we want to enter forebearance to lay off a $20k loan. For a Tesla we want to finance and beef up our emergency fund. Thoughts?",1654101098.0
How do you like to breakout your budgets?,2,v0oork,budget,https://www.reddit.com/r/budget/comments/v0oork/how_do_you_like_to_breakout_your_budgets/,2,"Curious how people in this sub likes to break out their budgets. How many sub categories do you usually like to break your categories out to? Or maybe you just use individual categories without sub categories

Examples:

Individual Categories - Food

Categories with Subcategories - Food > Restaurants/Coffee/Drinks

Categories with Subcategories with more subcategories - Food > Restaurants > Fast Food/Take Out/Dine In

Hope the example are clear. If there are other ways you do it, feel free to share in the comments! Thanks!

[View Poll](https://www.reddit.com/poll/v0oork)",1653872438.0
Running a survey on budgeting groceries for a class.,7,v0e9ta,budget,https://www.reddit.com/r/budget/comments/v0e9ta/running_a_survey_on_budgeting_groceries_for_a/,3,"**Grocery Budgeting Survey**

**Hey, in a class where I am researching habits around buying groceries. If anyone sees this, and only if you're inclined, I'd appreciate it if you could fill it out. It will help with my project and it's anonymous! Thank you!**

[https://docs.google.com/forms/d/e/1FAIpQLSdjRti1iUkP7oKVJrq22OSd7OoC1HYOjFYacyIzH0pxVIyuOg/viewform](https://docs.google.com/forms/d/e/1FAIpQLSdjRti1iUkP7oKVJrq22OSd7OoC1HYOjFYacyIzH0pxVIyuOg/viewform)",1653840211.0
Opening a second account,2,v01p6b,budget,https://www.reddit.com/r/budget/comments/v01p6b/opening_a_second_account/,1,"This is my first time in r/budget. Hi everyone!

I want to open a second account to better track and limit my spending. I'm pretty sure my credit union doesn't offer subaccounts. Can someone with experience using separate accounts suggest somewhere to use? An online bank like ally seems like it might work, but I'd like the opinion of someone with experience...

Thank you! 🙏",1653791008.0
"Newbie, halp!",3,uzrrvp,budget,https://www.reddit.com/r/budget/comments/uzrrvp/newbie_halp/,5,"Ok, so I am coming to a realization that how I spend money does not align with how much money I make, my goals, my debts, or my core values. 

-I make about $900 every 2 weeks
-My half of rent is $550
-My half of utilities is usually around $75
-I have no idea how much I should be spending on groceries but I know I’m spending too much, and still eat out at work regularly + have 13 year old child + 2 dogs + 1 cat.
-I smoke about a pack a day (I KNOW!) cigarettes are about $8.50/pack.
-Car insurance is $100/month
-I haven’t even gotten the title to my vehicle because I know registration is going to cost so much tags expire soon.
-I drive company vehicle most days, gas isn’t much because I only drive my car on weekends.
-Going through divorce, lawyer is minimum $165/month
-I need to do that thing where I pay on my student loan for a certain amount of time to get back in good standing.
-Ex fucked up taxes, I owe the IRS $1200 from last year and am scared to file for this year and now it is past deadline.
-I am making payments to my boyfriend for $1500 he loaned me, usually I pay his car insurance and his half of utilities ($175/month) still owe close to $1000.
-I just got a $400 ticket.
-Ex not paying child support.
-Do not qualify for food stamps.
-No savings. 
-Horrible credit.

Pleaseeee any advice, any basic budget ideas, how do I get myself into a better financial situation?",1653758102.0
Split budget for weekly pay,1,uzq5cf,budget,https://www.reddit.com/r/budget/comments/uzq5cf/split_budget_for_weekly_pay/,7,"Hi, I’m super new and this is probably a dumb question but here it goes anyways lol. I get paid weekly. I want to start split budgeting I think it is. How the heck do I start if I have no extra cash to get me ahead. I’m so confused or just not cut out for budgeting. Any advice?",1653753285.0
Blogs About Budgeting,4,uzi3an,budget,https://www.reddit.com/r/budget/comments/uzi3an/blogs_about_budgeting/,1,"Here is my personal list of interesting blogs about budgeting. These are blogs about creating systems of budgeting to earn, save and invest for the present and the future

The websites on the following list are my favorite blogs about budgeting for gaining total control of the money. They consist valuable information on strategies how to start budgeting, methods of organizing your finances, demolishing debt and saving piles of cash to reach your financial goals faster.

These blogs truly are the best of the best when it comes to budgeting your money! It is a real treasure for all of the people who are currently struggling with planning your financial situation. I hope you will like them too.

[**https://www.superbusinessmanager.com/blogs-about-budgeting/**](https://www.superbusinessmanager.com/blogs-about-budgeting/)",1653722230.0
"How would you budget $60,000?",11,uzah34,budget,https://www.reddit.com/r/budget/comments/uzah34/how_would_you_budget_60000/,9,"Hello, I’m single, not married, no children, no pets. 
Currently:
Car - paid
Car insurance - I pay dad $100 a month
Gas - $500/month
Credit card debt - $1,500 (15% interest)
Student loan balance - $6,000 (2-3% interest)
Nails: $300/month
Lashes: $200/month
Extra: I spend about $200 a month as a thank you on my parents (gifts, dinner, etc)
Retirement: $1,000 a month
Starbucks: $120/month
Food: $200/month

I don’t pay rent or any other bills. Most of my money go to mindless shopping. I was making $45,000/year but recently got offered a new job at $60,000. I want to start taking my finances more seriously and have started a budget spreadsheet but I’d appreciate different perspectives and how differently you’d spend/save/invest. 

I was thinking of cutting down my Roth contributions and setting up a savings account. Cutting out nails and lashes until my credit card is paid. I’m not so inclined on making more than minimum payment on my student loans since my interest is 2-3% on either loan. Then I was looking to save $20,000 for a house downpayment within the next 12 months.",1653693513.0
