,ID,Title,Post Text,Score,Upvotes,Media,Is_Video,Total Comments,Post Date
0,zw3k7j,"Moronic Monday - December 27, 2022 - Your Weekly Questions Thread","This is your safe place for questions on financial careers, homework problems and finance in general. No question in the finance domain is unwelcome.

Replies are expected to be constructive and civil.

Any questions about your *personal* finances belong in [r/PersonalFinance](https://www.reddit.com/r/PersonalFinance/), and career-seekers are encouraged to also visit [r/FinancialCareers](https://www.reddit.com/r/FinancialCareers/).",6,0.76,,False,10,2022-12-27 02:00:10
1,zwk93s,Wall Street’s Big Banks Score $1 Trillion of Profit in a Decade,,740,0.93,,False,122,2022-12-27 16:59:23
2,zx01bk,Tesla stock marks lowest close in years as investors worry about Musk’s focus | Tesla,,13,0.82,,False,15,2022-12-28 04:18:28
3,zw017m,U.S. SEC votes to advance stock market overhaul proposals,,738,0.98,,False,104,2022-12-26 23:20:17
4,zwxoam,"Is this jacaranda finance website real, im looking at the reviews on productreview.com.au and they all seem really positive, it seems to good to be true, can someone help me recognize if its a scam or not?",,0,0.5,,False,2,2022-12-28 02:24:14
5,zwy59d,marketGOATS' Players Out-Perform S&P 500 Index by up to 30 Points,,0,0.25,,False,0,2022-12-28 02:46:27
6,zwdzny,Don’t Embarrass Trump Over Tax Records Release—Charge Him Instead,,1,0.51,,False,14,2022-12-27 11:55:12
7,zvc1y2,SPAC Boom Ends in Frenzy of Liquidation - WSJ,,201,0.96,,False,17,2022-12-26 01:41:55
8,zv75k6,A Small-Cap Surprise,,32,0.63,,False,2,2022-12-25 21:29:43
9,zstxbp,Sam Bankman-Fried Released on $250 Million Bail Ahead of FTX Trial,,831,0.95,,False,244,2022-12-22 19:01:07
10,zt22h5,"Scott Minerd, Guggenheim Partners’ Investment Chief, Dies at Age 63",,138,0.92,,False,15,2022-12-23 00:45:44
11,zsmgs5,"GDP Q3 final estimate 3.2%, exp. 2.9%, last 2.9%",,106,0.95,,False,7,2022-12-22 13:47:51
12,zsbpe6,Republican senators propose overhaul of Federal Reserve amid concerns about politics,,339,0.92,,False,99,2022-12-22 04:08:02
13,zrwlz2,U.S. existing home sales fall for 10th straight month in November,,867,0.97,,False,101,2022-12-21 18:30:59
14,zqay5c,"Moronic Monday - December 20, 2022 - Your Weekly Questions Thread","This is your safe place for questions on financial careers, homework problems and finance in general. No question in the finance domain is unwelcome.

Replies are expected to be constructive and civil.

Any questions about your *personal* finances belong in [r/PersonalFinance](https://www.reddit.com/r/PersonalFinance/), and career-seekers are encouraged to also visit [r/FinancialCareers](https://www.reddit.com/r/FinancialCareers/).",40,0.88,,False,71,2022-12-20 02:00:12
15,zmlcy6,ECB raises eurozone interest rate by 0.5%,,348,0.97,,False,46,2022-12-15 13:42:11
16,zlzwf7,The Fed announced a 50-basis-point rate hike today. Projects raising rates as high as 5.1% before ending inflation battle,,843,0.97,,False,121,2022-12-14 19:29:19
17,zloo4x,"ECB sees inflation above target through 2025, source says",,208,0.97,,False,17,2022-12-14 11:35:02
18,zkftfa,FTX founder Sam Bankman-Fried arrested in the Bahamas after U.S. files criminal charges,,3805,0.96,,False,255,2022-12-12 23:45:01
19,zkym6p,"Nasdaq, NYSE Set to Ease Rules on Direct-Listing Capital Raises",,28,1.0,,False,3,2022-12-13 15:36:56
20,zkvvjf,US November CPI +7.1% y/y vs +7.3% expected.,,36,0.89,,False,34,2022-12-13 13:33:28
21,zjvkc9,Business-cycles and Cash-on-Market: Pre-money Startup Valuation in the Macroeconomic Environment,,110,0.92,,False,5,2022-12-12 10:52:15
22,zkj0be,"Moronic Monday - December 13, 2022 - Your Weekly Questions Thread","This is your safe place for questions on financial careers, homework problems and finance in general. No question in the finance domain is unwelcome.

Replies are expected to be constructive and civil.

Any questions about your *personal* finances belong in [r/PersonalFinance](https://www.reddit.com/r/PersonalFinance/), and career-seekers are encouraged to also visit [r/FinancialCareers](https://www.reddit.com/r/FinancialCareers/).",6,1.0,,False,33,2022-12-13 02:00:10
23,ziw0p3,Is it worth investing in precious metals?,,1,0.52,,False,10,2022-12-11 15:17:33
24,zgy1bh,"Fed Expected to Keep Peak Rates for Longer, Dashing Hopes for 2023 Cuts",,497,0.96,,False,96,2022-12-09 13:58:28
25,zgxnle,"Producer Price Index (PPI) News Release just came out: Actual 0.3% increase in November Expected 0.2% MoM, Core 0.2% MoM",,110,0.92,,False,24,2022-12-09 13:41:15
26,ze4ja8,"Deutsche bank, Rabobank hit with EU antitrust charge over bond cartel",,589,0.99,,False,25,2022-12-06 11:49:00
27,zds0u8,"Blackstone’s property bets are getting shakier — Rent growth is slowing for residential real estate, which makes up over half of the private-equity giant’s portfolio",,1049,0.98,,False,92,2022-12-06 02:15:25
28,zderwj,Wharton professor Jeremy Siegel roasts Jerome Powell as the Fed continues to signal more rate hikes despite signs of falling inflation: 'I don't know what planet he lives on',,976,0.87,,False,148,2022-12-05 18:19:34
29,zdro1t,"Moronic Monday - December 06, 2022 - Your Weekly Questions Thread","This is your safe place for questions on financial careers, homework problems and finance in general. No question in the finance domain is unwelcome.

Replies are expected to be constructive and civil.

Any questions about your *personal* finances belong in [r/PersonalFinance](https://www.reddit.com/r/PersonalFinance/), and career-seekers are encouraged to also visit [r/FinancialCareers](https://www.reddit.com/r/FinancialCareers/).",9,1.0,,False,77,2022-12-06 02:00:08
30,zdhk0b,"Market turmoil threatens to undermine efforts to curb inflation, says BIS",,11,0.87,,False,1,2022-12-05 19:54:32
31,zbm2jp,Venture Capital Finance: Which Factors Matter Most? Can Startup Valuation be Micro-Targeted?,,125,0.89,,False,13,2022-12-03 17:53:01
32,z9xmku,Blackstone limits withdrawals at $125bn property fund as investors rush to exit,,606,0.97,,False,94,2022-12-01 19:47:42
33,z9lqk1,"When the chips go up: Big banks bet on S. Korea, Taiwan stocks for 2023",,510,0.98,,False,70,2022-12-01 11:42:16
34,z7g1ir,"Moronic Monday - November 29, 2022 - Your Weekly Questions Thread","This is your safe place for questions on financial careers, homework problems and finance in general. No question in the finance domain is unwelcome.

Replies are expected to be constructive and civil.

Any questions about your *personal* finances belong in [r/PersonalFinance](https://www.reddit.com/r/PersonalFinance/), and career-seekers are encouraged to also visit [r/FinancialCareers](https://www.reddit.com/r/FinancialCareers/).",7,0.78,,False,85,2022-11-29 02:00:12
35,z4p6ry,Tech’s reality check: How the industry lost $7.4 trillion in one year -CNBC,,986,0.96,,False,68,2022-11-25 21:46:19
36,z1q9l2,"NY Fed: Bank liquidity may be tighter than thought, with policy implications",,511,0.97,,False,127,2022-11-22 10:32:32
37,z1h8wz,"Moronic Monday - November 22, 2022 - Your Weekly Questions Thread","This is your safe place for questions on financial careers, homework problems and finance in general. No question in the finance domain is unwelcome.

Replies are expected to be constructive and civil.

Any questions about your *personal* finances belong in [r/PersonalFinance](https://www.reddit.com/r/PersonalFinance/), and career-seekers are encouraged to also visit [r/FinancialCareers](https://www.reddit.com/r/FinancialCareers/).",19,0.86,,False,55,2022-11-22 02:00:10
38,z0bmil,Collapsed FTX owes nearly $3.1 billion to top 50 creditors,,1432,0.97,,False,174,2022-11-20 18:38:09
39,z0h2mm,Mortgage market upheaval spurs $17 billion in paper losses for banks,,448,0.97,,False,46,2022-11-20 22:16:13
40,yyn3sr,Masayoshi Son owes $4.7bn to SoftBank following tech rout,,616,0.98,,False,73,2022-11-18 15:43:01
41,yx9cne,Sam Bankman-Fried tries to explain himself,,925,0.92,,False,386,2022-11-16 23:08:29
42,yvxudr,Global investigators pounce as FTX collapse leaves potentially 1mn creditors,,813,0.98,,False,90,2022-11-15 13:52:13
43,yvjmgm,"Moronic Monday - November 15, 2022 - Your Weekly Questions Thread","This is your safe place for questions on financial careers, homework problems and finance in general. No question in the finance domain is unwelcome.

Replies are expected to be constructive and civil.

Any questions about your *personal* finances belong in [r/PersonalFinance](https://www.reddit.com/r/PersonalFinance/), and career-seekers are encouraged to also visit [r/FinancialCareers](https://www.reddit.com/r/FinancialCareers/).",29,0.97,,False,63,2022-11-15 02:00:12
44,yumonk,The FTX debacle makes SEC Chair Gensler look bad—again,,357,0.93,,False,89,2022-11-14 02:44:07
45,yur7bo,WSJ News Exclusive | JPMorgan Dodges a Buyout-Loan Bullet,,55,0.95,,False,2,2022-11-14 06:40:35
46,ytqyvv,"FTX’s founder was called a modern-day J.P. Morgan. The analogy still works — Though one of them failed and the other died rich, both of their careers make the case for central banks",,922,0.85,,False,144,2022-11-13 03:47:14
47,yt4cr8,Exclusive: At least $1 billion of client funds missing at FTX,,1094,0.97,,False,230,2022-11-12 11:22:49
48,ysose2,Musk Warns Twitter Bankruptcy Possible as Senior Executives Exit,,1119,0.95,,False,252,2022-11-11 22:12:31
49,ysgkep,Re-sharing from April: an amazing profile of bankrupted wunderkind Sam Bankman-Fried,,61,0.85,,False,16,2022-11-11 17:11:44
50,yrzgbf,"Subprime Auto Bonds Hit by Skipped Payments, Falling Used-Car Values",,458,0.98,,False,53,2022-11-11 03:00:00
51,ys7rkv,JPMorgan’s “transitory” intransigence,,24,0.88,,False,2,2022-11-11 11:29:59
52,yr5vk5,Amazon Becomes World’s First Public Company to Lose $1 Trillion in Market Value,,1325,0.97,,False,132,2022-11-10 05:02:32
53,yrfbgz,"October CPI: Inflation moderates, rising at annual 7.7% over last year",,160,0.97,,False,15,2022-11-10 13:41:30
54,yqachh,Credit Suisse Spinoff (of FirstBoston) Asks If World Needs a New Investment Bank,,359,0.94,,False,39,2022-11-09 06:05:53
55,ypc7rf,Senator Warren Raises Pressure on Fed Over Ethics Lapses,,762,0.93,,False,78,2022-11-08 05:26:18
56,yovi07,EU says it has serious concerns about Biden’s Inflation Reduction Act,,667,0.84,,False,280,2022-11-07 18:21:44
57,yo9ydb,China to implement policies to boost private investment,,331,0.95,,False,54,2022-11-07 02:15:40
58,yp7zhp,"Moronic Monday - November 08, 2022 - Your Weekly Questions Thread","This is your safe place for questions on financial careers, homework problems and finance in general. No question in the finance domain is unwelcome.

Replies are expected to be constructive and civil.

Any questions about your *personal* finances belong in [r/PersonalFinance](https://www.reddit.com/r/PersonalFinance/), and career-seekers are encouraged to also visit [r/FinancialCareers](https://www.reddit.com/r/FinancialCareers/).",4,0.75,,False,37,2022-11-08 02:00:10
59,yoq1j7,[OC] What If You Had Invested $100 in Each of The FAANGs 5 Years Ago?,,22,1.0,"{'reddit_video': {'bitrate_kbps': 4800, 'fallback_url': 'https://v.redd.it/6udv8cz6qjy91/DASH_1080.mp4?source=fallback', 'height': 1080, 'width': 1080, 'scrubber_media_url': 'https://v.redd.it/6udv8cz6qjy91/DASH_96.mp4', 'dash_url': 'https://v.redd.it/6udv8cz6qjy91/DASHPlaylist.mpd?a=1674835260%2CNGRhOTE1YmE3Y2MxOGIxYzFhMGY4MGMzNWE4NDg2Yjg0ZTU5MjVmNDJkNjgxY2IwNDhiMzRjNzgwMTY1ZmZiMg%3D%3D&v=1&f=sd', 'duration': 20, 'hls_url': 'https://v.redd.it/6udv8cz6qjy91/HLSPlaylist.m3u8?a=1674835260%2CMzBhZjZmMDNiMGVlZmEwNjUxZTQwYmRlNTg4ODBlZjFhMmZhYjgxNDYyNjM3ODA2MWQ0NmQzOTQ4OGJiNzdiZg%3D%3D&v=1&f=sd', 'is_gif': False, 'transcoding_status': 'completed'}}",True,2,2022-11-07 15:19:15
60,ykcir2,Fed approves 0.75-point hike to take rates to highest since 2008 and hints at change in policy ahead,,812,0.93,,False,123,2022-11-02 18:13:12
61,yk1l48,The Fed is expected to raise interest rates by three-quarters of a point and then signal it could slow the pace,,854,0.94,,False,215,2022-11-02 10:31:04
62,yjo871,Bank of Canada reiterates that rates need to rise to fight inflation,,285,0.95,,False,18,2022-11-01 22:59:59
63,yjf250,Bank of England ends one of the most remarkable economic exercises in history: quantitative easing | Business News,,558,0.97,,False,86,2022-11-01 17:30:21
64,yjqcnc,George Soros: Issuing perpetual bonds would show that Sunak is serious,,29,0.75,,False,20,2022-11-02 00:29:58
65,yimzbg,"Eurozone inflation hits 10.7% in October, as growth slows dramatically",,745,0.97,,False,96,2022-10-31 19:55:07
66,yilzyr,Higher Interest Rates Fuel Losses at the Federal Reserve,,281,0.97,,False,33,2022-10-31 19:22:37
67,yivp46,"Moronic Monday - November 01, 2022 - Your Weekly Questions Thread","This is your safe place for questions on financial careers, homework problems and finance in general. No question in the finance domain is unwelcome.

Replies are expected to be constructive and civil.

Any questions about your *personal* finances belong in [r/PersonalFinance](https://www.reddit.com/r/PersonalFinance/), and career-seekers are encouraged to also visit [r/FinancialCareers](https://www.reddit.com/r/FinancialCareers/).",7,0.89,,False,82,2022-11-01 02:00:10
68,yhwlh5,Cull of the corporate zombies,,334,0.93,,False,32,2022-10-31 01:12:52
69,yhcu3e,Wealthy buyers turn cautious on luxury home loans,,571,0.94,,False,54,2022-10-30 12:14:56
70,yhf8tv,"IMF cuts forecasts for Asia, warns region will be worst-hit",,221,0.96,,False,13,2022-10-30 14:10:45
71,yg4b4f,The great decoupling with China will reshape markets,,659,0.97,,False,87,2022-10-28 23:49:26
72,yfrx0w,Germany dodges recession but inflation climbs to 11.6%,,1141,0.97,,False,106,2022-10-28 15:50:45
73,yeui7e,"U.S. GDP accelerated at 2.6% pace in Q3, better than expected as growth turns positive",,1074,0.96,,False,215,2022-10-27 15:12:10
74,yfr3zf,"Multi-strategy hedge funds are the new, superior fund-of-funds",,7,0.65,,False,8,2022-10-28 15:24:08
75,yetq80,One Man Helped Credit Suisse Make Billions From Russia Tycoons,,495,0.96,,False,30,2022-10-27 14:40:30
76,yf2f2u,ECB hikes rates by 75 basis points and scales back support for European banks,,111,0.94,,False,6,2022-10-27 20:27:16
77,yd2pit,All-to-All Trading for US Treasuries?,,87,0.87,,False,19,2022-10-25 11:40:40
78,ycbgl0,The real reasons why Western companies chase Chinese sales,,345,0.91,,False,63,2022-10-24 13:35:54
79,ycszyz,"Moronic Monday - October 25, 2022 - Your Weekly Questions Thread","This is your safe place for questions on financial careers, homework problems and finance in general. No question in the finance domain is unwelcome.

Replies are expected to be constructive and civil.

Any questions about your *personal* finances belong in [r/PersonalFinance](https://www.reddit.com/r/PersonalFinance/), and career-seekers are encouraged to also visit [r/FinancialCareers](https://www.reddit.com/r/FinancialCareers/).",6,0.81,,False,34,2022-10-25 02:00:10
80,yaoodv,Russell Napier interview - “We will see the return of capital investment on a massive scale”,,364,0.92,,False,81,2022-10-22 14:06:11
81,yb6v4o,Managing a Bond Fund,,15,0.8,,False,6,2022-10-23 03:29:34
82,yado5a,Unravelling the Endgame of Trussonomics - What The Heck Was Liz Truss Thinking?,,473,0.93,,False,93,2022-10-22 04:10:06
83,y9dl7f,"As Covid Hit in Early 2020, Washington Officials Traded Stocks With “Exquisite Timing”",,1613,0.98,,False,108,2022-10-20 23:35:30
84,y92mh7,Liz Truss Resigns as U.K. Prime Minister After Tax Plan Caused Market Turmoil,,1106,0.97,,False,101,2022-10-20 16:20:14
85,y9qsjl,Private banks get billions from the ECB and European taxpayers will foot the bill - Follow the Money,,21,0.92,,False,11,2022-10-21 11:04:43
86,y93frg,10y3m has inverted,,69,0.96,,False,50,2022-10-20 16:51:19
87,y7l63q,Fed may need to push policy rate above 4.75% -Kashkari,,720,0.94,,False,158,2022-10-18 22:36:56
88,y6dpcy,China Delays Indefinitely the Release of G.D.P. and Other Economic Statistics,,1693,0.97,,False,242,2022-10-17 15:16:23
89,y6tlqe,"Moronic Monday - October 18, 2022 - Your Weekly Questions Thread","This is your safe place for questions on financial careers, homework problems and finance in general. No question in the finance domain is unwelcome.

Replies are expected to be constructive and civil.

Any questions about your *personal* finances belong in [r/PersonalFinance](https://www.reddit.com/r/PersonalFinance/), and career-seekers are encouraged to also visit [r/FinancialCareers](https://www.reddit.com/r/FinancialCareers/).",4,0.83,,False,70,2022-10-18 02:00:11
90,y5emze,"Ukraine’s Marchenko to chair IMF, World Bank governing boards in 2023",,436,0.91,,False,32,2022-10-16 11:33:50
91,y58od4,"‘Ridiculously stupid’ economic policies have the U.S. hurtling toward a ‘perfect storm’ of economic pain, Ray Dalio says",,956,0.88,,False,317,2022-10-16 05:32:52
92,y58qkx,FX Traders Eye Japan Response as Yen Approaches 150 Level,,71,0.95,,False,11,2022-10-16 05:36:46
93,y4xhlw,Credit Suisse prepares Swiss business sales to raise capital,,328,0.99,,False,21,2022-10-15 20:15:16
94,y3vpl0,Liz Truss appoints Jeremy Hunt as UK chancellor and scraps corporation tax cut,,648,0.97,,False,74,2022-10-14 14:38:25
95,y4habi,Bostic acknowledges accidental trading that violated Fed's ethics code,,6,1.0,,False,6,2022-10-15 07:15:09
96,y3usnb,The Pool,,16,0.7,,False,8,2022-10-14 14:01:42
97,y2bd70,"Fed officials expect higher rates to stay in place, meeting minutes show",,987,0.97,,False,147,2022-10-12 18:23:28
98,y1ohjo,'Get this done!' BoE's Bailey gives UK funds 3-day deadline to fix problems,,358,0.97,,False,66,2022-10-11 23:59:56
99,y185f8,Serious debt crisis unfolding across developing countries - UNDP,,593,0.98,,False,107,2022-10-11 12:44:54
