question,answer
"Hello all,       I started taking SS benefits at age 62.  Now I am back to work earning $45K which I know is over the $19,650 threshold. I know there's a $2.00 over $1.00 you earn or something like that. My question is how do I calculate thatand how do I pay back any over payments?   I'm now 63 and past the suspending my benefits. I just started this new job3 months ago.   Thanks.","This is a completely different thing than referred to by the OP.   At any age after 62, if you are taking social security, the above fed taxation applies.   What the OP was talking about was the reduction in benefits from working (before full retirement age).  Yes, there is also the reduction for taking the benefits early, but that happens whether you work or not.   At FRA, income has no impact on benefits (but of course does on taxes)"
"On July 1 I mobile-deposited a tenant's Chase cashier's check into a Chase checking account. Yesterday I saw a little red circle and a message saying ""We put 1 or more transactions on hold."" and it shows the amount of the check. It says the funds will be available July 6. If the tenant is at risk of NSF, then I'm confused as I thought a cashier's check meant funds had been earmarked and set aside to ensure a transaction would go through.If Chase is concerned about the risk of fraud, then I'm surprised as the pay-from account, deposit-to account, amount, and timing are very regular.And since the payor and payee both have Chase accounts, I don't see how Chase could be worried about the paying bank's solvency or doubt the check's authenticity. What might be going on?","Normal business hours...a little bit after noon Pacific. This tenant has been paying by Chase cashier's check for nearly a year, and Chase hasn't delayed the funds like this before."
"Some credit unions and banks have early direct deposit. If you use direct deposit, they make it available a day or two early, sometimes even sooner than that. The ones I know that offer this feature are listed below.  If you know of others, let me know and I'll add them to this post.  When doing so, be sure to specify what their membership eligibility requirements are, so I'll know how to classify them. If early direct deposit is available only for some accounts, or to some members, please specify the details of eligibility for early direct deposit.  Any corrections would be welcome as well.  Open membership credit unions: 1. Langley FCU (2 days)2. Hanscom FCU (2 days)3. DCU (2 days)4. PenFed (2 days)5. Unify FCU (2 day)6. Andrews FCU (1 day)7. Chartway FCU (1-2 days) 8. Service CU (2 days)9. Affinity FCU (cash back debit checking account) (2 days)10. US Senate FCU (1-2 days)11. Consumers CU (Illinois) (1 day)12. USAlliance (2 day)13. Mountain America CU  (according to @Royalbacon it is open to anyone, although website says otherwise; if you have contrary information please let me know so I can immediately remove it from the open membership category)14. SDCCU (2 day) (per @Brian_Earl_Spilner) Somewhat limited membership credit unions: 1.  NFCU (1 day) (Most members have to specially request the early direct deposit) Very limited membership credit unions: 1. Abri (1 day)2. University FCU, Mountain America, America First (all 1-day)3. Golden 1 (1 day)4. FCCU (First Community Credit Union) (Houston) (2 days)5. Baxter CU (2 days)6. RBFCU (1 day or 2 day) 7. Knoxville TVA Employees CU (2-3 days)8. Point Breeze CU (1 day), Sky One FCU (1-2 days), Union Square CU (2 days), GPO FCU (1 day) (courtesy Royalbacon)9. South Florida Educational FCU (1 day)10. Wescom CU (2 days)11. SCSCU (1 day)12. University of South Florida CU (1 day)13. VyStar CU (2 day)14. Jovia Financial CU (2 day)15. Municipal Credit Union NYC (1 day) (per @WomanITGeek)16. America First CU Banks: 1. Chime Bank (2 day)2.  Woodforest National Bank (2 day)3.  SoFi (2 day)4.  USAA (1 day) (very limited membership)5.   One Finance6.   5/3 Bank (with Momentum checking)7.  Capital One (with 360 checking)8.  Citizens Bank (2 day)9.  Discover Bank (2 day) (courtesy @AndySoCal)10. Ally Bank (2 day) (courtesy @GatorGuy)11.  Huntington Bank (geofenced) (2 day) (courtesy @Royalbacon)12. JPMorgan Chase (with ""Secured Checking"" type of account)13. Wells Fargo (courtesy @difringe) (this one is questionable see @FireMedic1  post: https://ficoforums.myfico.com/t5/Personal-Finance/Wells-Fargo-to-Credit-Direct-Deposits-Early/m-p/66...  Other: 1. Fidelity Cash Management (1 day) (Note: an earlier thread with the same title has been closed, due to its age.)","IME I called Navy's automated system when I had a pending deposit and it asked if I wanted it made available immediately, I said yes please lol.I did this 2 weeks in a row and now I receive my DD a day early every week without calling in. I tried calling previously and asking a CSR about early DD, but they said they couldn't do it. So, I guess that's kind of a YEMV."
"I have a question for the forum. It seems like there is an inordinate amount of people on this board who are members on NFCU, with more reporting joining near-daily. I'm just curious how so many people are getting membership. Do we have that many military/military families/DoD employees here? Doesn't seem like laws of large numbers support so many of them members here being in that group. And I know there were people who go tin through the loophole when it was open. Just like to know if there is something I'm missing.","Yes, the qualification net grows quite quickly.  When I joined this forum and heard all the praise of NFCU I thought that would be good but I can't get in...  I was very briefly tempted with the loophole, but didn't bother.   Then I realized that my wife's father had been in USMC, so she could join, and then so could I, even though I am an alien (who fought against US troops in 1812, well, I was young then).   That is how they grow....."
"So I just took out a personal loan of 12000 at 11.3%. The first payment is not due until July 30th. A credit card that I have has just offered me a balance transfer of 5.8% and that rate stays until the balance is paid off. Meaning there is no time limit to have it paid. The fee is only 2%. Obviously, I pretty much know my answer is that it is a smart move. My main question is how to personal loan companies look at this (in this case Goldman Sachs) if the loan is paid off before the first payment? Thank you","80% utilization on one card will hurt your scores, regardless of how low your aggregate utilization is."
Sounds like a good deal if you're within 12ish months of paying off your loan(s) and can afford a higher payment. May help some save on interest! AODFCU rate madness,I received a few emails over the last couple of weeks about this.Definitely a good deal if you're looking right now!
I recently join service FCU about a week ago applied for cc now they say send POInisent docs and last 2 years of tax returns now they say they didn't receive I sent it twice at email they gave me. Thinking bout Joining Interior FCU as a replacement. What u think I should do?,"There are good credit unions which aren't willing to lend to me.  That doesn't make them bad credit unions  I like Interior because (a) they have good products, and (b) even when they denied my application, they gave me good, personalized, customer service. Sometimes I quit a good credit union because I don't think they want to lend to me.  Hanscom is in that group. It seems to me like a great credit union. But their underwriters don't seem to like my kind of profile. I probably applied for credit with them 5 or 6 times. Eventually I gave up. Some good credit unions which have been willing to lend to me and are open to all are PenFed, Langley, Unify, Affinity, Evansville Teachers, Digital, BECU, Alliant, and Chartway."
"Cash back debit card accounts are a dime a dozen. Almost all the ones I have heard of fall under the Kasasa brand and have a lot of hoops to jump through to get the cash back. For example, you may have make 12-15 signature debit cards transactions and have a $500 or direct deposit to qualify for the cash back. Affinity Federal Credit Union is unique. It has cash back debit card account with no strings. It does not appear to branded or affiliated with the Kasasa brand. You get 1% cash back capped on $1000 spend for a maximum $10 cash back per month. No minimum debit card transactions and no direct deposit requirements. Are any other cash back debit card accounts, like the one at Affinity Federal Credit Union, with no strings attached. Preferably anyone could join? EDIT: Here is one : https://www.quontic.com/banking/checking/cash-rewards-checking/Edit 2: Never mind Quontic bank. They have scathing reviews at depositaccounts.com@Bill77 Unfortunately, I have read Discover cash back debit card does not work with PayPal bill pay like Affinity does. That is a must have for me.","I assume the reference is to the ""Pay your Bills"" feature in Paypal, where you can pay various merchants (you cannot add ones not already in the list) and charge to any credit or debit card.   The merchant receives a check or ACH transaction"
"Hi everyone,I have 37k in my savings account and have been saving for a mortgage down payment for a while now. I am able to save about $1000/month. I currently just have it sitting in a regular checking account, not doing much of anything. With interest rates and APRs/APYs raising, I have decided to 1. Hold off on a home purchase for now and keep saving, and 2. Do something with this chunk of money while it sits. I have been looking into high yield savings accounts, etc. but just don't know a lot. I want to make this chunk of change do something if I can while I am saving for a house. I am thinking at this point, I am AT LEAST looking at a year out from a purchase, if not two or more. Any advice and suggestions are appreciated!","Two separate things.  Among no-strings accounts, Alliant is currently well behind the leaders.   It's around 45th on the list Best High Yield Savings Accounts for November 2022 | DepositAccounts behind many well-known names such as Capital One, Discover, Ally, Barclays  and Sync (OK, some may not like that one!).   And even among these, which are far from the rate leaders, the difference is a much as 0.65%, which on a 2.35% base is quite substantial.  So no, Alliant is not ""invariably among the leaders"" unless we widen that definition.  And some of the real rate leaders have been pretty stable over time. My point about brokered CDs is that currently provide a quite good rate for those willing to do such things.  Alliant's 12 month IRA is 3.45%, again quite far from 4.75% So basically not sure why the love for that particular institution!"
"I hope this question isn't being asked in the wrong place but is it good for my credit to get a CLOC from NFCU? I'm in the process of my build and have the NRewards, 2 Certificate's, savings, checking, and an SSL already. Would it be smart to add this or should I wait?","I don't think you need it but it's possible that it fills out your credit mix.  I would wait and see if your credit mix is less than ""excellent"". If so, you could add that. It's good as a protection against checking overdrafts. It winds up getting scored like a credit card. The interest rate isn't great, so if possible it's better to have it but not to use it."
"Hello Again Everyone! It's been a LONG time since I've posted.. I haven't really needed credit for anything lately, and still don't, but do need some advice on what to do with our savings. We saved up almost $30K because we were planning to buy a house this year. Unfortunately, prices are so ridiculous where we live ($650K+ for a 2-3 bedroom) and we needed my mother-in-law to move in with us immediately. We ended up renting a house from the same landlord we've had for almost 10 years and all moved in together. So on to my question: what should we do with this chunk of change? It's just sitting in our savings account accruing like $1 in interest LOL. I'm not well versed on the savings programs or what's even offered, so some advice would be greatly appreciated! Also, I don't forsee us needing this money any time soon. We both have great jobs and together make about $150K - $180K per year and I would like to continue adding money to our savings.  Thank you all!","Exactly, so they want to be your primary bank.  All of the accounts that pay well above the averages of the long-term dominant players in this market have strings attached whether it is direct deposit, minimum balances, maximum balance to receive the higher rate, fees, etc. There are also a lot of lenders that bait-and-switch getting consumers to sign up with a really awesome rate, then later eroding the earnings or otherwise devaluing the account. Sofi is a fairly new player in this market so time will tell if they remain as competitive. (They changed to the checking+savings with direct deposit model just a few months ago.). Meanwhile there are a handful of banks that perennially offer among the best rates with no/low fees or no minimum deposits. That includes the ones I mentioned like Goldman Sachs Marcus, Discover Bank, Capital One Bank , PenFed, Alliant Credit Union, and a few others such as AMEX or CITI high yield savings.  I usually recommend sticking with the institutions who have a long track record and don't play games."
I need help deciding what to do.Im not great with money and I am trying really hard to get better but as a newly single mother of 3 it is very hard. I do budget but i've had to use my sinking funds for other things. So the Christmas fund was gone a couple of months ago. I did not plan very well for Christmas and I dont have money for presents (its my own fault). I have charged a balance on most of my cards. I was supposed to be paying them off every month but that has not happened.  I have been trying to save because I will be moving next summer. I am bad at saving so I put about 8k in a CD at an online bank. The penalty to close it is the interest I've earned no extra fees. I need to pay off my credit cards I've charged up about $2700  and have money for Christmas.I want to buy a house next year and I do not want my DTI to be trash so I really dont want a loan payment showing on my credit.  1.Would it be best to Open a CD at Navy Fed and borrow against it? the interest rate would be between 7%-18%2.Take out a payday loan or title loan (so it doesnt hit my credit)3. Just use my savings I dont know when I will be able to build it back up,My advice would be to pay off the credit cards.
"Hey guys I applied for a penfed card since the last time I tried in 2017... conditionally approved but it says ""member has a negative share balanace"" I'm assuming that's what's holding the approval... what's the fastest way to deposit money in Penfed?. Says Zelle won't work for 65 days since I just opened the account again.",Fastest way is to pull an ACH transfer from an external account if you have an external account set up with them. Otherwise I'd try electronically depositing a check in the mobile app.
"Hello everyone, Fairly new here, need some advice and heard these forums were a good place to start.  I currently have 2 credit cards, 1 at 17,000 at 17% interest and 1 at 8500 at 12% interest. I make approx. 8500 a month, but have quite a few financial obligations which has left me making minimum payments. My credit score is approx 710 and I have used about 50% of my available credit. I am looking for a way to try and get ahead in the next 2-3 years or at least limit the interest fees I am paying. I make approx 400 dollar payments on the 17k but incur 270 in interest per month. I rent, have 2 car payments, have a spouse who can work minimally due to health issues, and thankfully have great health insurance. After a fairly conservative budget I am left with a few hundred per pay check if I am lucky. I am looking for recommendations for possibly consolidating debt while I take appropriate austerity measures to pay down this balance and just wanted some ideas, I am not terrible with money but not great. I appreciate any tips or ideas.  Thanks!","My suggestion would be to join a good credit union and apply for a lower interest debt consolidation loan. Another suggestion is to join a good credit union that has a low interest, non-rewards, platinum card with no balance transfer fee or cash advance fee, and use that card to pay off high interest credit card debt."
"Recently I got approved for NFCU second card with a credit limit of $1000...So, I received a letter from them about my internal score which is 251 but that shocks me a lot because I have Flagship checking account with them for many years that I use all the time, Saving account for many years...Money market account for so long...Pledge loan for so long... CD for a year...My whole salary is being deposited as DD each week for so long....and have a credit card with a CL of $49k for last 3-4 years...My question is not about why I got so low SL, rather why my score is slow with them when I pretty much have almost everything with them?? Its seemed to me that its a myth when people think or believe that having as many as accounts with them would raises internal score with NFCU...7-8 months ago I got the same internal score with them which made my application for Flagship cc got denied...Something doesn't seem right in this picture....My Fico score is 829 and utilization is less than 1%... In my personal opinion- if you have any account with NFCU and if you don't use that enough then no matter how many accounts you open with NFCU, you would get very low score and limit on second card unless you get your second card within first 6 months of obtaining first card....",Scores mean next to nothing.I got denied with 333 and $25k with like 313.They have their ways but they are great over the long haul.GL!
I recently opened a Savings account with Penfed. I want to start my relationship building with them and am looking for suggestions about the best way to go about it. I also was happy to learn that they give your EQ Fico for free. Unknown to me when I tried to access it I found out that a savings account does not qualify for access to your score. See the email below So I decided to also open a free checking account and was approved for it. Below are my DP'sNew file I have an oldest account of 4years 3 months but it is through rent reporters. Other then that all accounts are starting from February this year. 2/22- Cap 1 Platnum Secured $301 SL 2/22- Discover it Secured $300 SL 2/22- Open Sky Secured $200 SL 3/22- NFCU NRewards Secured $200 SL 3/22- 3 self report util bills and 1 rent reporting 4/22- Amex BCE (AU) 30kChecking/Savings W/Citizens-NFCU-Penfed-Del-one FCU2/24 Inquiries for TU/EQ/EXNo derogsNo Judgements EQ 8- 0  9-808TU 8- 0  9-779EX 8- 0   9-0 (rent reporters not on this report)it should only be 2 months before I have a Fico 8 score.   I would like to open a CC with Penfed but want to establish a good relationship first,"I find it fascinating that their list of accounts which qualify for viewing the credit score omits their only good account, the premium savings account.  It seems to me that the easiest way for you to get the credit score would be to get (a) the free checking account and/or (b) a debit card. As to relationships with financial institutions, I always smile at that thought, because I never feel I have, or ever could have, a ""relationship"" with any of them.  But of course if you want to build a track record with them, the more accounts you have with them the merrier, as far as they're concerned.  And they will all love you to death if you deposit lots of money, getting no or low interest, and at the same time borrow from them, paying much higher interest. And nowadays they really seem to love people paying for things with their debit card, a practice which I consider inadvisable."
"Hey FICO Friends,I just wanted to pass on some interesting information when requesting a DD-214 from the National Archives. The process has changed quite a bit since I last used it.I ordered my grandfathers Navy DD-214 about 4.5 years ago. They had 2 sections where to order them. Depending on when person served. The receipt of documents took about 3 months.My cousin is doing some genealogy on our family and asked to borrow. I let her borrow for awhile and saved a digital copy. My cousin showed my aunt, who got emotional and wanted a copy. My grandfather's daughter, so I let her keep my copy.I went to the website August 8th. Ordered a new copy on updated form. There's no longer a separate site for older records. I received an email this morning, telling me documents were ready to download. They now send you a password protected copy, with digital seal. You have 30 days to access documents before they expire. I'm shocked they located documents and sent them in less than 2 weeks. I just wanted to give everyone a heads up. I haven't seen anyone mention this change.","I definitely thought it was worth mentioning. I spoke with an Archives Technician about getting physical copy, instead of it being emailed. It is possible, just leave off email address when inputting your contact info. Not sure how long that delays receipt. I'm impressed they found WWII military files in less than 2 weeks."
"What is your biggest personal expenditures every month. Kinda want to see where I stack up.  Mine is most definitely....Rent - $780Therapy & Medications - $500College - (stuff that they don't bill to Financial Aid) - $150 ish All other bills are $120 or less. Food is paid for with student fees (on campus) or food stamps (such a huge help, absolutely no shame about it). *I am in college finishing my BS (2 years left then to the MS).**I am also in my late 20s.","When I last attended college (in Canada in '89), tuition was $1100/year.  Rent was about $350 ($700 split two ways). Currently, my mortgage consumes ~ 2/3 of one bi-monthly paycheck; my DTI tends to hover between 19 and 23%. My son's undergrad tuition (Canada, 2017-18), annualized, was ~ $CAD 650/ monthly -- more than his rent, but a bargain by U.S. standards. Fun fact -- adjusting for inflation, my son's tuition cost about the same as mine.  The same does not hold true when comparing U.S. tuition rates."
"My mission: to increase my FICO scores in the medium term (1-2 years from now). My situation: The only debt/credit I've ever had is credit cards. I have 2 credit cards, 10k limit on each, one is 10 years old, one is 1 month old. 0% utilization. Never used any nontraditional credit reporting stuff, but I've paid rent and electric on time for 5 years. My intelligence: 0 My plan: Get a 10-20k personal loan from my current bank (no prepayment penalty), immediately pay off 90+%. My question: Is this a good or bad plan for achieving my mission? Why or why not? Where can i find similar topics discussed? Thanks in advance.","If the goal is to improve your score, then add a 3rd credit card and show balance on one only! But pay in full for statement balance. In short months your score should be around 750+."
"Hi, I have been using QuickBooks for the last five years, and it has been working smoothly. But, Recently, when I tried to log in to the account, I couldn't do so because I forgot my login credentials. So, to regain access to the account, I tried to recover QuickBooks Account but couldn't find any appropriate instructions to do so. So please let me know if any of you can assist me with my query as soon as possible. Is there any simple way to restore the lost login credentials of QB so that I can get access to my company data and proceed with my ongoing data?","Are you using QB Online or a Desktop product? I went awhile without using QB until again recently. My phone number and email address hadn't changed, and my user ID was my email address, so resetting my password to use QB Online was easy."
"Hello all, I have $4500 credit between 4 cc. I recently relocated for a new job and have used $1100. My utilization will not report until the end of June. (I always report 3 to 4%) in attempt to bring my utilization down in advance (1st paycheck not until end of July) Would it be better to apply for a new cc and balance transfer or take personal loan with credit union I have one of my cc with? Thanks","IMHO it would be better to do neither.  It would be better to take a small hit in your scores and just weather it. If you apply for a new credit card you'll have a hard inquiry, you'll be resetting your age of newest account, lowering your average age of accounts, and adding another account with balance. If you apply for a loan you'll have a hard inquiry, you'll be resetting your age of newest account, lowering your average age of accounts, adding another account with balance, and adding an installment loan which has a high proportion of balance to loan amount."
"PLOC = personal line of creditOLOC = overdraft line of credit attached to checking account to stop overdrafts If you shopping for a line of credit, is there a reason to choose one over the other? Are APR typically similar? I am leaning towards a oloc because of the automatic handling of overdrafts. The oloc at NFCU has checks that you use. Does that make this product a hybrid: OPLOC (overdraft personal line of credit)?","They're both personal lines of credit. I find the overdraft type more convenient, because it saves me the step of transferring from one to the other. No matter which kind I am using at the time, I never use the special LOC checks; I can't keep track of those the way I can keep track of regular checking account checks and tranfers. So if I'm using the non-overdraft kind, I transfer the money into checking and then use it."
