,Question,Answer
30,"if you become extremely rich, is it possible to keep it a secret or is it bound to become public?","completely secret? or just low profile? you can be super rich and completely unknown. who’s this guy? he’s one america’s 100 richest people. he co-founded home depot. i’m pretty sure that unless you worked for home depot you probably have no idea who he is. i am guessing he can walk around most cities in america and not be recognized. complete secrecy is harder because most wealth of that type winds up getting involved in public companies like home depot. those companies have to disclose things like how much they pay their executives. this is why we know exactly how much mark zuckerberg or tim cook make every year. their companies have to disclose this information because they’re public companies. the ownership stakes of these companies is also public so we know how many shares of meta zuck owns. on the other hand, if you inherit your money, then you can keep that private. similarly, if you own a private company, that is also largely confidential. these things get out and in today’s society, you are not completely safe from scrutiny no matter who you are. the super high profile rich guy thing isn’t required. people like elon musk seek out the public spotlight as does bill gates and others. they seek to use their wealth to make public policy or simply to influence people and/or events. you don’t have to do that and most rich people don’t do that."
31,do you have to be rich to start a farm?,"well yes, unless you are willed a farm from a relative. to be successful in farming and make a living, you need at least 3 thousand acres of farm ground and that’s dry land, so you will have to summer follow. the equipment is really expensive, then you have seed, fertilizer, fuel and chemicals and none of them are cheap. if you are operating on borrowed money then it can be tough, especially if mother nature doesn’t corporate. you will have good years and you will have bad years, it’s just part of it. i farm about 480 acres of irrigated corn and it cost me about $200 dollars per acre just to put it in the ground. i own a silage chopper and it cost $380 thousand dollars new, and i only use it for about 3 weeks out of the year."
32,why does the qatari government suddenly care about following islamic rules and regulations specifically regarding the world cup?,"qatar has always been a relatively conservative muslim country. qatar practices a madhab (school of thought) in islam that is more closely aligned with that of saudi arabia. the difference is, much like the uae, qatar opened up to the outside world much earlier. i’ve been to qatar & one of my sisters actually went to university in qatar. she often said that the local qataris were more religious than many iranians. most abstained from alcohol, prayed daily, visited the mosque on fridays, and dressed modestly. even the wealthier students at her university could often be seen dressed like this. but qatar is very modern, and given the large and rapidly expanding expatriate population, the locals are relatively tolerant of other faiths & cultures. qatar is also seeking to grow its international relevance, so they’re walking a tricky tightrope of maintaining their conservative image while also showing that they’re open to foreign business & tourism. what many people don’t realize is that qatar is actually playing a very clever game of politics. qatar is amplifying & publicizing its strict (for the average wc) rules in an attempt to gain respect & prestige in the muslim world. many westerners are looking at the rules with disgust. but many people in the muslim world & even some conservative christians are praising qatar for not backtracking on their religious laws. qatar is single-handedly boosting its popularity & influence in the region with limited financial benefit. it’s actually an incredibly smart strategy."
33,"how much money is typically made off of one published book that sells 3,000 copies?","for the author? not much. an average paperback these days retails for about $16. a typical author’s commission is 5% to 15%, depending on format—5% for a new author and a mass market paperback, 10% for a trade paperback, 15% for a hardcover. assume a trade paperback. 3,000 copies at $16 is $48,000. ten percent of that for the author is $4,800. don’t quit your day job."
34,"if i found one million dollars in a hidden safe in a house i bought, can i just deposit it in my bank account without getting into trouble?","there is no way you're that lucky, but if you are, here is what i would do (the devious way): don't tell your children. the fewer people know the better. leave the money there for six months. if the sellers come back to claim it, give it to them. if some thug comes looking for it, give it to him. try to learn about the history of the house to see whether anyone used to live there is currently in jail. if so, that's trouble. don't touch the money. i'm thinking whoever hid the money might have died unexpectedly without informing any family members. in that case, you're safe. after six months, get another safe and find another place to keep the money, and dispose the old safe altogether. if someone comes back asking for it, say you know nothing about it. maybe the sellers took it or someone else could have gotten to it before you, a contractor, the home inspector, etc. so many people have come through the house, you don't know who. then go and buy reloadable american express or visa gift cards where you can refill with cash at a local store, like cvs - not the same one every time. don't load too much into the cards, maybe $200-$300 at a time. basically all your expenses from this point are paid with gift cards. don't carry too much cash with you. it's dangerous. use gift cards instead. that's being said, don't run back to the safe too often. take out $10k at a time, divide it up among your family members and each should have a safe place to keep the money. for your job, don't do direct deposit into your bank, get a paycheck for every pay period. when you deposit that check, attach a random amount of cash, less than your paycheck or a little higher but not much, so it wouldn't seem weird. then every 4-7 months, deposit a random amount between $7k-$10k into your bank, never the exact amount like $7k or $10k, and never whole dollars. so it should be like $7023.94. if you're married and each of you have two bank accounts, that's an addition $60k or so a year to pay toward your mortgage. if you have a side business where you get paid with checks and cash (one of my friends bartenders for fun), you can attach some more cash whenever you deposit. once you have a decent amount of money in the bank, either buy a couple rental properties or pay off your mortgage. please consider it a gift and don't squander it."
35,what would happen if i walked into a bank to deposit $1 million dollars in cash? do most banks have machines that do the counting?,"to deposit $1 million cash in a bank, first the bank will want to know where this money came from. this is called “know your customer.” this is a federal law and they can get into huge amounts of trouble if they just took your money. assuming they buy your story on how you got the money, they will have to count it. if it is all $100s, then a teller should be able to count it all in under an hour. if it is in mixed denominations, it will take much longer even with a machine (not all branches have those machines). after they finish counting your money, they have to fill out a federal form telling the government that you just deposited a large amount of cash. this may make the government curious and they could start an investigation on you. also, the branch that you went to may not want to take your money. because banks don’t like a lot of cash around for security reasons, they will have to schedule another visit from the armored car company to get rid of the cash. that will be an additional expense. plus if it is a small branch, they may not have extra tellers to sit down and count all of your money."
36,how do you feel about the todd and julie chrisley case and the outcome and prison sentences as “rich people”?,"todd and julie chrisley are the protagonists in a usa network show called chrisley knows best. the show follows the interactions of todd and julie, along with their kids, living their affluent lives. my wife loved that show and thought they were hilarious. i thought they were annoying, entitled jerks. ostensibly, todd and julie were successful real estate developers who lived a lavish lifestyle. that turned out not to be so true. what they were actually doing was inflating the value of their properties for loan purposes, using that money to finance their lifestyle, then getting other loans to pay off the debts. it was a ponzi scheme with banks as the investors. along the way, they developed and presented fake financial statements to inflate their net worth and income when it was convenient and deflate those numbers when the tax man came calling. if all this sounds familiar, it should. after being convicted of bank, tax, and wire fraud, todd got 12 years in federal prison, and his wife, julie, got seven years. they each got 2 - 3 years of supervised release as well. under federal rules, they will have to serve 85% of their sentences, so todd will next breathe free air in 2034 and julie in 2029. those are appropriate, given the nature and scope of the crime."
37,"what's the coolest thing you own, that's not expensive?","what is the coolest/most impressive but non-expensive thing you own? this: it’s one of those tough, nearly indestructible plastic coke bottles, filled with water (the bane, of course, of the mid-oceanic plastic island). it’s so cool because it has a simply incredible pressure seal (this due to the obvious need for a bubbly coke for a good pressure seal). it won’t leak or break (tough plastic) in a backpack, wherin i like to carry water, whereas many other purposeful “sports bottles” will often create a mess (especially the ones with that conveinient pop-valve titty thing). this one shown is well over a year old, and the cleverly designed (no washer needed!) seal has not let me down yet. cheers."
38,why do rich people like to buy expensive watches?,"this is me and my watch, alongside a white americano. link: rolex yacht-master 40 watch: everose rolesor - combination of oystersteel and 18 ct everose gold - m126621-0001 i wouldn’t say i’m rich (yet haha) but i earn a good living and have some property side business that i do ok out of, totalling a personal income of around £150k per annum for both endevours. a lot of the answers here talking about the movement, and craftsmanship bla bla. honestly that was furthest from my mind when i bought mine. for me there were three clear reasons that compelled me: the purchase of this watch was based on two successful professional milestones for me. the first was on my second year as a self employed consultant i had just come off the phone from my accountant at my year end and he told me there was a decent amount of money left in the business. so i went and bought my first rolex a datejust 2. the second, was i’d just finished a big property refurbishment project and i had refinanced taking out a decent amount of money i had put in. so i traded my datejust and upgraded to the yatchmaster pictured. i remember both of those wins whenever i wear the watch, that for me is worth it. safe store of money. i’ve worn this watch sparingly for over a year and it is worth £1k more used than i bought it for new, so close to 10% increase. not bad. my friends have them. haha. shallow reason yes, i admit there’s an element of competitiveness or keeping up with the jones’s. i also like my appearance to be a positive reflection of where i am in life. and finally, i could afford it so why the f not?! haha. so yeh those are my non rich person reasons. but honestly, there could be fairies or baby yoda inside moving the hands and i would be non the wiser! :)"
39,has anyone become millionaire by working for someone else?,several of my employees have salaries in excess of $2.6m per year. i have not asked them if they are millionaires. it's none of my business. by definition a millionaire has a net worth in excess of $1m. it seems to contradict the idea that you can't get rich working for someone else.
40,"how do you think the government should distribute wealth? should they tax the rich more heavily and use those funds to help the poor, or is there another method you prefer?","that’s really strange…i read my constitution, i read my bill of rights, the declaration, the notes from the founders during the constitutional convention - and i just can’t find anywhere that government is empowered to “distribute wealth” according to its preferences and desires. in fact, i read a lot of stuff about government existing to secure and protect our rights, and among our rights are private property rights. in other words, the right to the fruits of our labor. it would seem to me that a government that arbitrarily decides to take from some and give to others is simply trampling our rights, not protecting them. far too many don’t understand that the compelling thing about america is that we’re founded on the idea that government exists to protect our natural rights. we have a society organized around the idea that our individual freedoms and individual liberties are central to civil society. the american approach stands in stark contrast to nations based on various flavors of marxist philosophy where the individual’s rights are subordinated to the needs of the state. in that form of government, the individual exists to serve the state, and such a nation might indeed bother itself with actively distributing wealth as the elite see fit so as to enrich themselves and their favored groups. here in america, every patriotic american should be disgusted by the idea that some believe government should distribute wealth according to its whims."
41,what should i do to improve my personality?,"your conduct must be calm. too much frenzy, excitement or aggression makes you a people repellent. be light, be calm, smile and take tough decisions. never push yourself on people, don't do over to impress them; this acts against you. if someone doesn't wish to be impressed, this won't work at all. be nice, be humble, be what you are and let people decide. some would like you; some won't. don't expect everyone to love you. one who doesn't care much about other people’s judgement about them stays free of the pressure of standing up to people's expectations. they walk on the chosen path with pride and respect themselves irrespective of achievements or failures. no high ego, no inferiority complex. such people have a strong personality. value your words; it's not that you have been given the power to speak so you can say countless meaningless words each day. respect what you say, and consider it a verbal contract or commitment. be right, and don't fear facing the consequences. it means learning to say no when you can't, learning to stand against any number of people if they are wrong and you are right, don't judge your values through materialistic results or money. if honesty means less money, you need not evaluate monetary results for your honesty. be highly respectful to everyone, especially the people who have anything lesser to you, be it money, talent, skills, privileges. giving respect costs only a little ego and gives you a beautiful image for life. but remember, this doesn't stand true for disrespectful people. anubhav jain"
42,does having money allow people to get away with crime in america?,"question: “does having money allow people to get away with crime in america?” yes. unequivocally, yes! look, for example, at the case of robert h. richards iv. here is a headline. “ du pont heir dodged prison for raping 3-year-old daughter after judge ruled he 'would not fare well' behind bars ” or look at the case of the actor robert blake who murdered his wife. or look at the jeffrey epstein sex trafficking case. epstein is a pervert who molested or had sex with over one hundreds girls as young as 13. or you might want to review the ethan couch affluenza case. ethan killed four people. ""affluenza"" case: ethan couch, who killed 4 in dui wreck, set for release just up the street from my apartment in chicago marshall berlin, the wealthy vice chairman of the i. s. berlin publishing company, threw a metal chair and pushed his nude “girlfriend” to her death through the window of his high rise apartment in the john hancock building. when the police arrived mr. berlin was not even there. but his lawyer was. berlin did not call an ambulance or the police. he called his lawyer! berlin refused to answer questions or take a lie detector test. the building windows had to be sent out of state for testing because it was believed that a chicago or illinois company could be too easily bribed. berlin got away with murder. woman falls from john hancock center - newspapers.com these are just five of hundreds of cases i could cite where a wealthy man committed murder or child rape and used his wealth and influence to get away with it. on a smaller scale, i know a guy who because he is a big political campaign contributor is “connected” and cannot be arrested. he routinely violates traffic laws directly in front of cops and they won’t touch him. they recognize his car and very low license plate number and let him do what he wants. he even laughs about it, saying “watch this” as he does something egregiously illegal right in front of a couple of cops. the one time that i know he was stopped, by some honest cops who did not recognize him, he used his mobile phone to speed dial someone in the mayor’s office and simply handed his phone to the cop. the cop repeatedly said “yes sir” to someone on the phone and then repeatedly apologized to mr. big for inconveniencing him. in my town a there is a woman from a prominent family who is a drunk. when she was stopped for drunk driving the cops, rather than arresting and charging her as they would do to you, called the mayor to ask what to do. the mayor drove to the site of the stop, ordered the cops to forget the incident happened, and gave the very drunken woman a ride home. the cops obediently complied. why? how do wealthy people get away with crimes? at every stage of of the crime and the investigation and, if there is one, the trial the wealthy person will be treated very differently than you or i would. cops are frightened of wealthy men and reluctant to offend them. the wealthy belong to the same clubs and socialize with and give campaign contributions to the politicians who control whether the cop has a job or not. the wealthy can and do make trouble for anyone who crosses them. and they have more reason to use that influence and call in favors if they have committed a crime. many government agencies and police departments restrict access to files concerning politicians, the politically connected, celebrities, and the wealthy. these files are kept in secure areas to which access is severely restricted. as early as the 1970s computer systems at these agencies and departments were configured to block access to these vip files. access required special authorization from the top brass. any attempt to look at them without such approval, for example merely typing in the name of a vip, would trigger an alarm and start an investigation, not of the vip, but of the employee who dared to look at the files. the wealthy have lawyers and fixers on retainer and on speed dial. they pay them enough so that no matter where they are or what hour it is their mouthpieces will show up to protect them. when marshall berlin pushed his girlfriend through that high rise window and her body smashed on the pavement berlin’s lawyer arrived before the cops and was waiting for them. there are means by which the wealthy can deliberately commit crimes while avoiding prosecution. wealthy clients frequently ask lawyers, accountants, and bankers: “how can i get away with this?” there are ways to deceptively structure criminal business operations and tax evasion schemes so as to both disguise them and make them so expensive and difficult to trace that prosecution is highly unlikely and a defense is designed in. law firms and accountants and banks will do this. the wealthy never talk to cops. any information the cops get is only obtained through the wealthy man’s lawyer after negotiation. unless you are in some place like the southern district of new york, the local prosecutors are always over worked and out classed by the legal dream teams that defend the wealthy. thus prosecutors, who have limited office budgets and who retain their jobs based upon their win loss ratios, are very reluctant to even bring a case against the wealthy. if they do go to trial the wealthy can afford to buy exonerating testimony from “expert witnesses”. when she worked as an attorney for a legal mega-firm my wife kept a list of doctors and experts known to be corrupt whom she referred to as prostitutes for hire. they would sell their services to the highest bidder and say whatever they were paid to say. the wealthy can select a jury that favors them. they do this by hiring psychologists to advise their attorneys during the jury selection process and expensive private investigators who examine the lives of every potential juror. thus, before the trial even starts the jury box will already be stacked with jurors who favor the wealthy defendant. before a trial even begins the wealthy defendant will have hired a very expensive public relations firm that will not only develop a plan of marketing the defendant to the jury but will attempt to subvert the entire jury pool through a massive marketing campaign. it is common for wealthy criminal defendants to hire professional wardrobe consultants and image and makeup consultants. what the jury sees on the stand is not the defendant but a professionally trained and made up and costumed actor. the wealthy who routinely engage in criminal activities or business practices for which they could be prosecuted if caught assiduously culture acquaintances with and offer favors to the power elite and ostentatiously donate a part of their ill gotten gains to the social associations for the wealthy that masquerade as charities. this allows them, if needed, to call in favors or have others testify to their “good character”. interestingly this protective behavior was originally promoted by the gangster al capone and was made mandatory by chicago’s lawndale mob which required that their sleazy members all contribute to charities. the wealthy can avoid prosecution by simply buying off their accuser, paying hundreds of thousands or even millions of dollars to make cases go away. the list of such men is seemingly endless. donald trump’s fixer is going to jail for this. but the list of the more notorious includes harvey weinstein, bill o’reilly, roger ailes, and michael jackson. the wealthy can simply pay to make charges go away. judges are generally white men from the privileged classes. although they are often hostile to and treat the poor and minorities very badly, they are very deferential towards the wealthy. i have seen these two behaviors from the same judge many times. for example, judge t. s. ellis, when sentencing paul manafort to less than the minimum recommended sentence, stated that manafort had “lived an otherwise blameless life”. manafort had not only lied to the fbi and engaged in witness tampering and committed crimes while awaiting trial but had enriched himself by engaging in tax fraud and bank fraud for thirty years! judges protect their own social class. the wealthy can buy district attorneys and judges. doubt this? look up operation greylord in chicago. operation greylord - wikipedia . or read about the non-prosecution agreement that allowed jeffrey epstein to avoid a life sentence and stopped the investigation of the other very wealthy men involved with epstein. opinion | nothing about jeffrey epstein's deal with prosecutors was remotely normal yes. if you have enough of it, money in the united states allows a person to get away with crime. as my attorney wife frequently tells me: “in the united states you can have as much justice as you can pay for”."
43,what are the signs that show a woman's wealth and class in britain?,"wearing tweed, wellingtons and a headscarf while driving a proper land rover is a sure sign of considerable inherited wealth."
