,Question,Answer
74,what makes czech republic one of the richest countries in europe?,"although czechia is clearly a developed country without any doubts. it isn't “one of the richest countries in europe"" so far. czechia is more less average eu country in the most metrics, pretty stable, calm and safe on the international and daily basis too. czechia is one of the 30 most developed countries on the planet…. is it nice there? yep. is it comfortable place for life? definitely. are there tens thousand of ppl who wanna relocate there every year? yes. is there very low unemployment, developed social state, good schools and healthcare? are you still doubts? without any pathetic nationalism, you are really lucky if you could live there no just from global but from european perspective too, because the vast majority of planet could just dream about something like this… how bad is it??? vojta rod · 2y how bad is it to live in czechia?seriously bad. i don't understand why anyone would live in this wasteland in the middle of central europe!!! 1 2 the empty main town square in small central bohemian town kouřim where all locals committed mass suicide because they realized their really pathetic existence. these events are quite common since the author posts this question here in quora… they can not live in such a terrible place anymore… we suffer under prosperity, developed system of social security, very good universal health care and education. we have a problem with low criminality and extremely low violent criminality. 3 awful maternity clinic where the daughter of my boss was born a couple of days ago. his wife suffers under world-class experts and it was covered by damn mandatory health insurance! i am so surprised they survived! 4 we have damn social protection and system of public transport literally everywhere and terribly low social differences compare to other developed countries… 5 we have to survive four seasons :( 6 most of us have to live in awful old houses that we haven't demolish yet. moreover more than 80 % of us own (at least) house or flat where we live and own summer houses, farm land or another properties are very common too. you know, poor people… 7 you could expect. “guys, if your past so sucks, present/future will be better”… no, it´s awful too. 8 we discovered fire last year and hopefully, the electricity will come very soon to our houses, maybe next year… (the street where i live) 9 we have awful national parks, natural reserves and wait for it!!!! gardens everywhere, so depressive gardens and people who do not have gardens have often awful flowers. 10 and i almost forget czechs are terribly educated people who love friends, hobbies, pets so generally speaking total trashy part of the human race. 11 czechs are so boring, lazy and terrible people. they don´t do anything interesting just drink beer and eat schnitzels… 12 czech society is generally speaking so backward so we imprisoned and burned people with magic electronic boxes yesterday (they called it cellphones) 13 everyone really cares, if you are christian, atheist or jew. it´s such a serious topic that most locals didn´t answer a religion question in regular national survey… it´s so bad, no fights between people because of religion… 14 people enjoy so much freedom. no!!! 15 locals are so racist and xenophobic. i don´t know what we do first? maybe push my indian flatmate under a tram. break shop window of italian bistro near my office. i could punch a ukrainian shop assistant from the local supermarket or attack vietnamese who run fast food in our street or i can choose from so many tourists! or should i focus on gays/lesbians, handicapped people, feminists, redhead? there are so many options and millions of attacks everyday… 16 we don't have heating in our houses so we have to make an open fire on the floor and find anything that burns. i found this room full of paper and parchment… some old garbage again… i don´t have to look for wood anymore! 17 this land is so terrible that the number of foreigners who live here rises every year. people from other countries hate this land so much that tens of thousands of foreign students want to study in our schools and a lot of them stay there after graduation and this awful place visit more foreign tourists than the population of the country every year. 18 we have over-filled deposits by old garbage everywhere…you know museums, galleries, librariers, art centers, theaters… useless! 19 tens of thousands of us have to work in labs and design studios and millions of others in offices or shops like slaves :/ 20 we suffer under the lowest unemployment in the eu and we have to spend our money in shops and buy nonsenses… 21 many of us suffer during hiking and cycling or other sports. i am going to go to a trip and i don't know if i survive tomorrow! 22 local nature is extremely dangerous and there are disasters every day. you can not go to nature because it´s so risky :(. for example, several of my relatives were killed by roebucks :/ 23 we face huge challenges every day. for example what kind of ice cream we will get! i got lemon but it was practically a life challenge! i am so proud of me. #firstworldproblems 24 we suffer… a lot, because except for all possible international cuisines, all types of meats, fruits, and the food we have to eat local cuisine too. it´s very similar like austrian or bavarian (south german) cuisine… awful… 25 politicians just talk and discuss… you know unitary parliamentary democracy… no, a strong leader or leading party that solves everything… it sucks! 26 locals news have so serious stories like stuck people in an elevator or reconstruction of highway d1 (no, it's seriously a nightmare…) 27 who wanna live in such a terrible place like this? make career, start a family, bringing up kids and get old. i don´t so i wanna definitely emigrate somewhere else. so i will load my stuff on my horse and leave this hell forever! 28 man! i hate this land so much!!!! *facepalm* hope, everybody understands i am sarcastic…i hope so :d if you wanna know more about life in our tiny hell check links below or ask me in the comment section: vojta rod's answer to what is it like to live in czechia? czech republic - wikipedia vojta rod's answer to is the czech republic good and economical for living? vojta rod's answer to what are some amazing facts about your country? vojta rod's answer to why is czechia such a safe country? vojta rod's answer to what are some things people get wrong about your country? have you ever thought of hell? i see it every day! xd 29 note mainly for non-european users: you don´t know but a lot of your imagination about europe is based on czech republic/czechia. why? 30 hundreds of global movies, series and commercials were made there. cz often cover other european location from movie casino royale or the chronicles of narnia, music clips of linkin park or kaney west to commercials of apple, htc or sony…. apple loves cz… a lot… 31 one old legend even claims that czechia doesn't exist and it's just a huge movie decoration... maybe … more in the video below… you maybe noticed, czech municipalities look very historical and yes, you are right. it has four major reasons. first, two are connected mainly to history - czech lands were one of the less damaged areas in europe during ww2 and despite extensive damage and decline of the country during ussr occupation, buildings mostly gradually fell apart during this age but we prefer reconstruction/rebuilding so we save literally ruined buildings/districts from demolition. another reason is a very strict law that protects historic buildings and finally kind of czech “traditional” attitude to architecture. 32 czechia is quite a small country but for your better imagination. this is the map of town/city protected reservations (strict protection) and zones (little bit less strict protection). these are not just a single building or complex but whole urban areas. there are more than 600 cities, towns, villages, landscapes, and archeological areas with this special type of extra protection. random example - manětín (pilsen region, western bohemia) general description: a unique document of the baroque concept of the town with landscape connections. an untouched composition of a terraced square, the south side of which forms the chateau. significant are the untouched baroque and late baroque buildings, sacral architecture, and rich sculptural decoration. so finally, guys without any primitive nationalism or optimism. locals are so lucky because there are not so many countries with similar or better conditions that we have there. the majority of the world could just dream about the standards and possibilities we have. so i feel damn lucky, i was born there. i'm my biggest limit… description of pics: 1. sand “dune” near vlkov village, 0,8 hectare located in south bohemia 2. prague-podolí maternity hospital opened in 1914 3. a grammar school in znojmo 4. underground so-called “new hall” of the main prague railway station 5. somewhere near broumov town, eastern bohemia. 6. kutná hora located in central bohemia (20 558 ppl) 7. congress center in zlín, eastern moravia 8. picture from game kingdom come: deliverance by warhorse studios based on real area and municipalities located in central bohemia…in the early 15th century. 9. town park michalov, located in přerov town, founded 1904, central moravia 10. some wine festival. there are tons of events like this. idk :d 11. exhibition of preciosa company focused on production and design of crystal glass 12. fire… no, it´s pics from walpurgis night 13. flying spaghetti monster 14. concert during national holiday 17 november - struggle for freedom and democracy day celebrating the fight of czechs against nazi and communist totalitarian regimes in the 20th century 15. anna nguyen in her banyan restaurant located in moritz gallery olomouc 16. strahov library 17. rector's of brno university of technology, south moravia 18. the crest hall of olomouc archdiocesan museum, central moravia 19. spadia laboratories in nový jičín, north moravia 20. shopping mall nisa located in liberec, north bohemia 21. tourists under gothic castle kost, eastern bohemia 22. cute roebuck 23. ice cream 24. schnitzel with potato salad 25. pic from chamber of deputies of the czech republic 26. weather forecast of tv nova 27. sculpture of horse ardo in breeding farm písek 28. frymburk ( 1 275 ppl) located in south bohemia 29. set of spider-man: far from home in beneš square located in liberec (north bohemia) 30. boskovice (11 622 ppl) located in south moravia 31. view to kadaň (18 202 ppl) located in north bohemia"
75,what is wealth to you?,"what is wealth to me? it’s a tool to achieve what i want. it’s also kinda make-believe… no - i don't mean i’m broke, i mean the whole concept of being wealthy (in some instances) is kinda sleight of hand. you see, we have a property portfolio. property in new zealand is quite expensive... as in ‘lot’s of zero’s’ expensive. we have quite a few properties meaning we have quite a few zero’s but, the zero’s aren’t ‘real’ until the property is actually sold and its value realised. let’s say someone has 5 million dollars in property in new zealand (that’s just like… 5 houses in auckland 😏- **also, avoid akl for residential-property investment) and the property market in nz dives by 40% then what that means is that someone's paper value of 5 million has just had their net worth effectively drop to 3 million (losing 2 million in equity) and the person hasn't even lifted a finger and is probably still making the same returns (depending on how they have their portfolio leveraged) and is only really affected if they want to borrow based on their net worth. let’s say someone had a property portfolio of 2 million and the same thing happened… they go from being a ‘multi-millionaire’ to … well… not being one. it’s a hollow title. (pointless sidenote: you need a net wealth of 3.86m to qualify as nz's top 1%). stocks are much the same. ditto for bullsh!t like bitcoin. look at ftx tokens: image source: link people went from imaginary billionaires to very real broke-a$$ paupers. when you start playing in this area, it’s at this point that you start to realize that ‘wealth’ and big money are often nothing more than a hollow facade based on what people think things are worth (at any given moment). in addition to that, interestingly, the genuinely wealthy people i know look like the most broke people on the planet (driving old utes and wandering around barefoot) whereas some others i know (who buy the latest cars and accessories and rent very large houses) are actually super broke and leveraged up to the eyeballs. wealth is often nothing more than 3 card monte. no one should be respected just because they're ‘wealthy’ or disrespected just because they might appear broke."
76,what is life like for someone with a net worth between $50–100 million?,"believe me, life remains the same. you are probably no longer worrying about home maintenance, property taxes, paying for kids supplies, eating out, school tuition and affording healthcare for your family, but you get used to it due to hedonic adaptation. i can tell you about myself and a friend of mine, €. while both of us belong to the technology industry, € took a different path with no intention of reaching the 50 million club. he achieved his feat by exploiting the software and ai industry and i can attest to the fact that his day to day life is bau. we hang out every time he pays me a visit to the west coast or when i go see him in atlanta. we go on boating, golfing and hiking expeditions around the world 2–3 times a year but other then that we are are doing the same things - dropping kids to school/tennis classes, grocery tips, fixing our cars for fun, continuous learning and trying new technologies, writing code, reading books etc. i will take €’s example first. around 8 yrs ago as a software engineer, he was running a fast food enterprise, prayosha philly group, which he sold for 5 million post-partner split and began looking into technology consulting opportunities. last year he got a roughly 20 million exit from a location intelligence company, and went on to join a cybersecurity & defense contractor in atlanta as their cto under a 9 million agreement. i have not seen any change in his lifestyle. one thing i admire about him is that he keeps a low profile and participates in philanthropy. if you talk to him, you will never know he’s worth a lot more than 50 million. as a child adoption advocate he believe’s a dollar tomorrow has no value if it can help someone today. that’s deep! in a world where 99% of the rich donate a portion of their wealth after death, € believe there’s no point waiting. while people like him are outliers, i am more of a conservative and i achieved my humble goal of generating $200k a year in retirement income in 2016, and am now shooting for $300k a year in order to comfortably take care of my two little ones and a 3rd on on the way. i manage that with stock market investments, rental income and a couple of book royalties. while i am not in the 50 million club with €, i am hoping to get there half way through in another 20 yrs if markets were to continue behaving as they have been in the past 10 yrs :-) hopefully this answers your question."
77,which political party is the richest: the republicans or democrats?,"surprisingly (to me), it turns out that this is the republicans. although the stereotypical image of a republican voter is poor and uneducated, it turns out that is only half true. according to mid term exit polls (2022) republican voters were more financially affluent than democratic voters to a statistically significant degree. however the bit about being less well educated still holds true. source: live exit polls 2022: election day exit polls for democrats vs republicanslive election exit polls by state during the 2022 midterm election between democrats and republicans, including race and other voter demographics."
78,why do some wealthy people dress like bums?,"i won't post a genuine picture yet one of my neighbors dresses and looks practically indistinguishable from richard from silicon valley: and his house looks like: the beginning cost for a home in this area is around 2.5m and his house is likely worth nearer to 4m. also, he dresses this way each and every day… also, he isn't the only one… pretty much every other individual in my local dresses in a similar easygoing clothing bereft of any marking and logos. do they seem to be ""bums""? no, yet they most certainly don't dress in a way that says, ""hello, check me out"". on the off chance that you ran into my neighbor in the city, you would likely not allow him another glance and assuming you did, you presumably would accept he will experience difficulty making the current month's lease haha…"
79,what would happen if everyone would become rich?,"haha good question. it isn't practically possible. let's prove it by contradiction. if everybody becomes rich, who would drive taxis and cabs. who would mine precious metals and minerals. in short, the economy would collapse. see, money is just a token. it has no absolute value. if everyone becomes rich ,the currency would have no value. the value of currency is given by goods and services in the nation. the total goods + services = relative value of money. for example, if their is only one apple in the country because nobody is working hard to produce it, because everybody has money. now, if everybody has million dollars, who would get that one apple.you would have to fight with everyone. the one who pays highest would get the apple. it would turn out that you bought an apple for a million dollars 💵💲💲. does that make sense?? you are still getting the same 1$ apple for a million. only ways somebody can become richer is by providing that worth of services and goods ,that is how they earn money. that is what entrepreneurs do, they use people and guide them to create goods and services for millions of people.now, the amount of knowledge, hardwork, and discipline is required to run a company makes it difficult to everyone to become rich. but everybody cannot be rich simultaneously as explained above. the poor people and middle class people run the majority of nation's work. ambani's themselves don't go and fixed the damaged mini cable. these little works are most important and are done by common people. so how to become rich?? be a good leader with immense amount of knowledge about everything. rich people are just very good managers and visionary leaders, who guides people on a dark lonely path by risking their own life. that is why they are paid the most. we as a common citizen are entitled to work hard and smart to create more amount of goods and services. for benefit of both ourselves and nation.we are entitled to earn and spend money. if you are working hard for yourself, at the same time you may be helping millions of people getting ease of life. that is also a trick that government uses. in developing countries such as india 🇮🇳, they have high inflation ,meaning that the prices keep on increasing steadily so as to keep the people working hard which indirectly benefit the country. (also taxes paid by the people when they earn is important for nation). edit: everyone can become rich at some point of their life time , but not simultaneously. let's say , a lot of old people become rich, then it is fine, they already have served the country well and have worked all through their life. young people at the same time would take the responsibility on their shoulders because they are just getting started. conclusion: people can become rich but they should provide that much worth of goods and services . i think this is enough, i don't want to go in too much details. thanks for reading. 😊🧘❤️🌼. i am open to suggestions, feedback and complaints. i am still learning."
80,what would happen if a rich friend deposited one million dollars into your bank account?,"someone would owe tax. if it’s income, you’d owe income tax. if it’s a gift, your friend might owe gift tax. there is a usd 5.49 million lifetime exemption on gift taxes, so if they just gifted the money to you, then there wouldn’t be tax. however, if your friend was really generous he might owe something. bank would ask. why did you get this money? you’d say. a friend gave it to me. after the bank verifies that your friend is not in the mafia, you’ll have friendly bank people offering you all sorts of investment products, and asking if you would be interested in a loan. if it’s money for work, it would be subject to income tax. if it’s a gift, it’s subject to gift tax. don’t try to do something clever with definitions, because the irs is used to defining things."
81,why do the rich get away with crimes?,"honestly? because they are in the same social circle as the politicians who make the laws and the prosecutors, judges, etc., and they donate tons of money to those politicians. plus, since they’re the ones who make the rules and set the penalties, they make punishment very lenient for the types of crimes they commit. here’s an example of what i’m talking about: a guy knocks down an elderly woman at an atm machine by grabbing the cash she just withdrew. if he gets caught and he’s poor, he will get a public defender and let’s say the elderly woman’s leg was bruised when he knocked her down. a three year stip in a maximum security prison would be a reasonable sentence to expect (oh, and a stip means he actually has to spend the whole three years in prison, no parole) and the type of prison i’m talking about is the kind you see in movies; shanks, fights, gangs, all that, so he isn’t going to have much fun. now, same elderly woman, but this time her financial adviser embezzles three million dollars, her life savings, her leaving her destitute with no money to pay for her home, food, medical expenses, etc. to the point where, before he embezzled the money she had a nice condo, a car, and that sense of comfort from knowing she had more than enough money in the bank to carry her through the rest of her life. and now she will be a ward of the state, spending her remaining years in a crowded government run nursing home. if her financial adviser is caught and convicted he might spend a few months or a year in a minimum security, and if his lawyer is good, a federal prison that has a jogging track, basketball courts, library and many of the other comforts of home. is that fair? who really hurt the elderly woman more: the guy who grabbed twenty dollars from her hand and bruised her leg, or the guy who stole her life savings and destroyed her life. actually i tried to trick you. the reason i said the financial adviser could expect to spend a few month or a year in prison was just a way for me to show the difference between the prisons where rich people go and the prisons everyone else go. in real life - and i’m not making this up - for the crime committed by the financial advisor, the theft of three million dollars, lets say he’s thirty-eight years old, wife, kids, etc, this is his first offense, i would not be in the least bit surprised if it was, in fact i would expect his sentence to be something like a hefty fine and community service, and of course restitution to the elderly woman which his lawyer will delay using legal ploys to tie the matter up in court until she finally dies."
